Jam,Tanggal,Bulan,Tahun,Username,Caption,Link,Like,Komentar
11,10,11,2020,aminuddin.maruf,Selamat Hari Pahlawan  Komitmen kebangsaan dan gotong royong menjadi pelajaran berharga dari para pahlawan kita Mari kirimkan doa untuk setiap pejuang yang telah mengabdikan diri untuk bangsa dan negara Alfatihah  haripahlawan,https://www.instagram.com/p/CHZbfJ4lxaq,304,6
12,7,11,2020,aminuddin.maruf,Akhir pekan masih kebagian tugas sharing session bareng adikadik mahasiswa di acara Paramadina Leaders Camp Berbagi pengetahuan bacaan dan pengalaman tentang kepemimpinan dan strategi tata kelola organisasi Saya menitikberatkan pada pentingnya membangun kebersamaan solidaritas upgrading soft dan hard skill serta tanggap membaca perubahan zaman   Thanks a lot temanteman semaparamadina aziemah____ sptmbr11  Acaranya keren  Salam Hormat Salam Takzim dan mari kita bacakan AlFatihah untuk Almarhum Prof Dr Nurcholis Madjid,https://www.instagram.com/p/CHRvLhoF-k9,807,39
22,6,11,2020,aminuddin.maruf,  Pemerintah berkomitmen untuk terus memfasilitasi setiap ikhtiar elemen masyarakat termasuk mahasiswa dalam menyampaikan pendapat demi terjaganya iklim demokrasi yang sehat di republik ini  Apa yang menjadi catatan dan rekomendasi temanteman akan kami pelajari dan sesegera mungkin akan saya sampaikan kepada Bapak Presiden _________ httpsmediaindonesiacomreaddetail358954presidenserapaspirasimahasiswaterkaituuciptaker,https://www.instagram.com/p/CHQRgZGnfx8,543,13
18,6,11,2020,aminuddin.maruf,Hari ini saya bertemu dengan perwakilan Dewan Eksekutif Mahasiswa perguruan tinggi keagamaan Islam Negeri Seluruh Indonesia PTKIN SI Ada dari Banten Samarinda Surabaya Malang Papua Metro Yogyakarta Semarang dan Makassar  Saya bangga semakin banyak Mahasiswa yang berani kritis dan terbuka dalam menyampaikan pendapat dan menyatakan sikap InsyaAllah rekomendasi para ketua DEMA PTKIN ini akan saya sampaikan pada Presiden Republik Indonesia  Salam hangat selalu untuk para agen perubahan dan perjuangan  ___________ httpsnewsdetikcomberitad5244482bemuiniainserikritikisiuuciptakerjastafsusjokowiakantelaah,https://www.instagram.com/p/CHP1lMoFT-i,1530,42
19,5,11,2020,aminuddin.maruf,Siang tadi saya menerima perwakilan dari Presidium Nasional Presnas BEM Perguruan Tinggi Muhammadiyah PTM seIndonesia Kami berdiskusi juga mendengarkan masukan dan kritik dari Presnas BEM PTM seIndonesia terkait omnibus law UU Cipta Kerja  Saya mengapresiasi pemerintah juga mengapresiasi atas langkah dari BEM Perguruan Tinggi Muhammadiyah yang telah membuka ruang dialog yang konstruktif ini  Pada intinya tadi kami menerima masukan dari Presnas BEM Muhammadiyah tentang UU Cipta Kerja untuk jadi catatan kita untuk ke depannya Kita bersama temanteman mahasiswa akan mengawal UU Cipta Kerja untuk menutupi kekurangannya dalam bentuk aturanaturan teknis turunannya agar aspirasi temanteman mahasiswa mampu diakomodasi  Tetap kritis tetap idealis Hidup Mahasiswa  _________ httpsnewsdetikcomberitad5242785stafsusjokowitemuibemptmuhammadiyahseriterimakritiksoalomnibuslaw,https://www.instagram.com/p/CHNYGu0na8N,426,7
17,29,10,2020,aminuddin.maruf,Shollu ala AlNaby Muhammad,https://www.instagram.com/p/CG7LEUhF-c9,469,3
11,28,10,2020,aminuddin.maruf,"Mari merefleksikan semangat sumpah pemuda dengan memaknai tumpah darah yang satu sebagai komitmen kebangsaan dan dedikasi kemudian memaknai bangsa yang satu sebagai  langkah bersama dalam Kerjasama dan kolaborasi dan yang terakhir memaknai bahasa yang  satu sebagai kesamaan visi  Merdeka",https://www.instagram.com/p/CG3-A8PlcLi,759,4
20,26,10,2020,aminuddin.maruf,Assalamualaikum Wr Wb   InsyaAllah tanggal 31 Oktober nanti akan bersilaturahmi dengan para kyai dan santri diaspora santridiaspora adalah mereka para santri yang berkesempatan berdialektika di negera lain baik untuk belajar berdakwah maupun bekerja  InsyaAllah akan hadir gus Ghofur Ustadz Shamsi Ali juga Gus Oding yang selain menimba ilmu juga aktif berdakwah di Luar negeri Ada juga Intelektual Muslim keren Sumanto AlQurtubi yang menjadi  Profesor di Saudi Arabia Selanjutnya akan hadir juga sahabati Ulfah dan Brother Anam yang keduanya adalah santri kandidat PhD di Eropa dan Australia  Ibu Menteri retno_marsudi juga akan hadir mewakili pemerintah sebagai bentuk dukungan terhadap diaspora santri ini  Sebagaimana yang disampaikan presiden bahwa Sejarah mencatat peran besar para ulama para kiai para santri dalam menjaga NKRI memandu ke jalan kebaikan ke jalan kebenaran ke jalan kemajuan Saya berharap silaturahmi ini bisa menjadi sebuah upaya tambahan untuk meningkatkan kolaborasi dan kontribusi santri untuk peradaban dunia dan peningkatan kualitas kehidupan berbangsa dan bernegara  Santri Sehat Indonesia Kuat  Yang mau ikut boleh mendaftar di Ratu Syaila 081218151624,https://www.instagram.com/p/CGzsivlFGf4,750,7
12,22,10,2020,aminuddin.maruf,Sebagai seorang santri dalam rangka mengenang seruan KH Hasyim Asyari dan para pejuang terdahulu perjuangan kita hari ini adalah untuk memulihkan Indonesia dari dampak wabah Pulih dan sehat raga dan jiwa  العقل السليم  في الجسم السليم Men Sana in Corpore Sano  SantriSehat IndonesiaKuat,https://www.instagram.com/p/CGojseRlFI8,1131,8
0,22,10,2020,aminuddin.maruf,Selamat ulang tahun istriku Alloh jaga Alloh sayang panjang umur dalam pergerakan bersamaku   Maafkeun karena masih dalam masa isolasi aku tak bisa bersamamu heuheuheu  I love you,https://www.instagram.com/p/CGnTcZElNqE,1798,26
22,21,10,2020,aminuddin.maruf,Insya Allah besok bersama dengan 100 pondok pesantren dari seluruh Indonesia kita akan melaksanakan WORKSHOP PESANTREN SADAR WABAH DAN BENCANA  Kegiatan ini selain bertujuan untuk meningkatkan kesadaran pesantren akan pentingnya mempersiapkan diri menghadapi segala jenis wabah dan bencana juga sekaligus dalam rangka memperingati Hari Santri Nasional  Santri Sehat Indonesia Kuat  pesantrendevelopment generasicerdasiklim,https://www.instagram.com/p/CGnE3GHloCc,397,2
20,16,10,2020,aminuddin.maruf,Kritik konstruktif seperti vitamin yg dibutuhkan untuk menjaga tubuh demokrasi tetap sehat Saya yg dididik dan dibesarkan di ruang aktifitas gerakan mahasiswa sangat memahami apa yg menjadi tuntutan dan keresahan temanteman  Terimakasih sudah menyampaikan gagasan dan sikapnya dengan penuh damai dalam suasana keakraban  Insya Alloh akan saya sampaikan kepada Bapak Presiden apa yg menjadi sikap dan tuntutan temanteman BEM SI  Jangan lupa jaga kesehatan Hidup Mahasiswa,https://www.instagram.com/p/CGaCrOIHutm,1103,39
18,14,10,2020,aminuddin.maruf,Senang rasanya bisa menyapa adekadek mahasiswa yang dapat kuliah melalui program KIPKuliah Ada Ario yang kuliah di Universitas Syiah Kuala Aceh Puji di Universitas Lambung Mangkurat Banjarmasin dan Shinta di Universitas Paramadina Jakarta  Alhamdulilah proses penyaluran KIPKuliah berjalan sesuai dengan harapan Banyak anak bangsa yang terbantu dengan hadirnya program ini Sebagaimana harapan presiden tidak boleh ada lagi yang tidak kuliah karena alasan ekonomi  Sukses selalu untuk semua mahasiswa baru di Indonesia Semangat,https://www.instagram.com/p/CGUogRInNQn,391,9
22,10,10,2020,aminuddin.maruf,,https://www.instagram.com/p/CGKuS9MH39k,923,34
23,9,10,2020,aminuddin.maruf,,https://www.instagram.com/p/CGIRNLTni7c,894,27
12,9,10,2020,aminuddin.maruf,Hari lebaran makan ketupat Belanjanya pergi ke pasar Silahkan sampaikan pendapat Tapi jangan main bakar  Buruh Mahasiswa parlemen jalanan Catatan sejarah dari dulu UU ciptaker itu untuk kesejahteraan Tapi digoreng banyak isu  Pacaran suka curi2 pandang Beli hadiah suka boneka Kalo berbeda pendapat soal undang2 Kuy kita pergi ke MK  Jangan lupa ya follow vinaseptianaaaa sang pemilik foto di atas,https://www.instagram.com/p/CGHFnBrFHh2,2848,141
14,1,10,2020,aminuddin.maruf,Aku tidak mengatakan bahwa aku menciptakan Pancasila Apa yang kukerjakan hanyalah menggali jauh ke dalam bumi kami tradisitradisi kami sendiri dan aku menemukan lima butir mutiara yang indah   Soekarno,https://www.instagram.com/p/CFywUKhFYrP,785,5
14,15,9,2020,aminuddin.maruf,Selamat datang mahasiswa baru unj_official di kampus hijau penuh perjuangan Jagalah idealisme sebagai modal utama mahasiswa jangan pernah merasa puas dengan keadaan terus bergerak menggapai Indonesia yg kita citacitakan Hidup Mahasiswa Aku UNJ,https://www.instagram.com/p/CFJj3i2HC1G,414,4
22,12,9,2020,aminuddin.maruf,Cekrek cekrek haha dia sudah bergaya,https://www.instagram.com/p/CFCpaEsnqws,206,1
21,19,8,2020,aminuddin.maruf,اللهم ما عملت من عمل في هذه السنة ما نهيتني عنه ولم أتب منه وحلمت فيها علي بفضلك بعد قدرتك على عقوبتي ودعوتني إلى التوبة من بعد جراءتي على معصيتك فإني استغفرتك فاغفرلي وما عملت فيها مما ترضى ووعدتني عليه الثواب فأسئلك أن تتقبل مني ولا تقطع رجائ منك يا كريم   Segala doa demi kebaikan pribadi maupun bangsa Indonesia semoga selalu dikabulkan Allah SWT di tahun ini  Amin ya Rabbal Alamin,https://www.instagram.com/p/CEEyuNXl_BQ,505,2
1,17,8,2020,aminuddin.maruf,Merdeka  Mari kita rayakan kemerdekaan ini dengan penuh rasa syukur dan semangat dalam meningkatkan kebermanfaatan diri  Anak muda merdeka adalah anak muda bermanfaat dan penuh karya,https://www.instagram.com/p/CD9ajrvl1hB,996,8
23,15,8,2020,aminuddin.maruf,banyak yg bilang dia copyanku waktu kecil,https://www.instagram.com/p/CD6tku4lBWq,655,4
12,14,8,2020,aminuddin.maruf,Indonesiaku berbudaya Indonesiaku beragama,https://www.instagram.com/p/CD29gS4l3m5,856,2
19,9,8,2020,aminuddin.maruf,Pandemi belum berakhir jangan pernah meremehkan dengan abai terhadap protokol kesehatan Jaga diri keluarga dan orang di sekitar kita dengan selalu mematuhi protokol kesehatan,https://www.instagram.com/p/CDqvyuklscL,153,0
22,3,8,2020,aminuddin.maruf,Tidak boleh ada yg tidak kuliah karena tidak ada biaya tidak boleh ada yg DO karena kesulitan ekonomi Pemerintah hadir untuk menyiapkan sumberdaya manusia indonesia yang berkualitas silahkan kontak temankip di daerah dan kampus yg menjadi tujuan anda informasi juga bisa dikihat di ditjendikti,https://www.instagram.com/p/CDbm9OPl4TA,704,27
17,3,8,2020,aminuddin.maruf,temanKiP adalah sebuah kerja sosial bersifat kerelawanan untuk memastikan manfaat KIPKuliah sampai pada mereka yang berhak Sebagai langkah afirmasi pemerintah untuk pemerataan  akses pendidikan tinggi bagi seluruh Indonesia Program ini untuk mensupport memperkuat temanteman di Kementerian Pendidikan dan Kebudayaan dan Kementerian Agama untuk program ini send dan terdelivered  Sebagaimana pesan Bapak Presiden jokowi jangan sampai ada yg tidak kuliah atau putus kuliah karena kesulitan ekonomi Jangan smp agenda strategis bangsa mundur apalagi terbengkalai di tengah pandemi ini,https://www.instagram.com/p/CDbJv72FgTm,651,8
15,31,7,2020,aminuddin.maruf,Apresiasi tinggi untuk jajaran POLRI bareskrimpolri divisihumaspolri di momentum idul adha bekerja untuk mewujudkan keadilan hukum yg transparan Momentum ini juga diharapkan memperkuat konsolidasi dan sinergitas antar lembaga penegak hukum kita  Penangkapan Djoko Tjandra atas perintah langsung Presiden jokowi kepada Kapolri yg dipimpin oleh Kabareskrim,https://www.instagram.com/p/CDTJnuSFhhM,226,2
18,30,7,2020,aminuddin.maruf,الله اكبر الله اكبر لا الـه الا الله و الله اكبر الله اكبر و لله الحمد   Selamat Hari Raya Idul Adha Semoga Allah Subhanahu Wa Taala menerima segala amal baik kita  Untuk yang esok hari sholat Idul Adha berjamaah jangan lupa menjaga protokol kesehatan ya,https://www.instagram.com/p/CDQ9_KTlSXq,583,1
15,30,7,2020,aminuddin.maruf,Terimakasih Bang ardibakrie atas waktu dan diskusi siang ini Banyak hal yg akan kami kerjakan bersama utk akses informasi terutama dalam bidang pendidikan dan pemerataan pembangunan yg berpihak kepada anak muda,https://www.instagram.com/p/CDQpfMSlMBm,1862,14
18,23,7,2020,aminuddin.maruf,Tawa anakanak adalah manifestasi terbaik dari pemaknaan masa kini dan imajinasi anakanak adalah fondasi terbaik untuk membangun masa depan  Selamat Hari Anak Nasional  harianak harianaknasional2020 masadepan,https://www.instagram.com/p/CC-6HtpFsic,178,2
12,18,7,2020,aminuddin.maruf, Upaya pencegahan COVID19 adalah kerja berkelanjutan yang membutuhkan komunikasi dan kolaborasi yang efektif antara  Pengambil kebijakan Ilmuan para ahli inivator hingga pemimpin dan tokoh masyarakat  Silaturahmi saya ke pesantren pada hari Jumat 17 Juli 2020 kemarin berupaya menyerap informasi sebanyakbanyaknya tentang keadaan pesantren dan pengalaman pesantren dalam penanganan COVID19 Informasi ini dibutuhkan untuk kemudian menjadi pengetahuan yang mungkin dapat dimanfaatkan pesantren lain juga menjadi dasar rekomendasi kebijakan yang akan diambil terkait dengan pesantren  Tetap semangat sahabatsahabat semuanya Jangan lupa pakai masker,https://www.instagram.com/p/CCxYaDilHqN,612,13
18,17,7,2020,aminuddin.maruf,Andara lahir waktu saya sedang sibuk2nya menyiapkan Kongres PMII di Palu 2017 lalu Iya dia lahir saat saya di penghujung pengabdian PB PMII Dari dalam kandungan dia lebih sering berdua saja dengan ibunya di rumah kontrakan kami saya lebih banyak keluar kota berkeliling dengan segala cerita lika liku sebagai aktifis mahasiswa   Sekarang dia beranjak besar tumbuh sebagai anak pertama kami banyak yg bilang anak pertama itu anak perjuangan semoga kelak besar dia tumbuh sebagai perempuan yg penuh semangat memperjuangkan dirinya keluarganya bangsa dan tanah airnya tentu saja juga agamanya  Saling mendoakan semoga kita selalu dalam keberkahan,https://www.instagram.com/p/CCvgROPF1nJ,820,21
21,16,7,2020,aminuddin.maruf,Malem ini dapet rejeki berlimpah makan enak dan yg nemenin orang2 keren Sepertinya malem ini bakal tidur nyenyak hehe,https://www.instagram.com/p/CCtKO09l9lN,1756,12
17,12,7,2020,aminuddin.maruf,  Alhamdulillah hari ini kembali bersilaturahmi dengan pondok pesantren kali ini di Asshiddiqiyah Batu Ceper asuhan KH Muhammad Ulil Abshor AlHafidz  Dalam silaturahmi ini dilaksanakan pula pelaksanaan uji cepat COVID19 untuk para santri baru Kita selalu berdoa dan berikhtiar agar para santri selalu dalam keadaan sehat dan tentu saja melaksanakan kegiatan sesuai protokol kesehatan Amin,https://www.instagram.com/p/CCigKwXloi9,487,8
21,5,7,2020,aminuddin.maruf,   Pengurus Organisasi Kepemudaan dan kemahasiswaan di tingkat pusat berasal dari ragam daerah Tugas utamanya adalah mengkordinasi penguruspengurus cabang dan wilayah juga membangun sinergitas baik antar organisasi maupun pemerintah dan swasta Hal ini tentu saja membutuhkan energi yang besar juga semangat yang terjaga  Menghadapi new normal aktivis organisasi diharapkan untuk terus produktif dengan tetap menjalankan protokol kesehatan  Siang tadi kami menginisiasi pelaksanaan rapid test untuk para aktivis pemuda dan mahasiswa Alhamdulillah 300 peserta nonreaktif COVID19  Tetap semangat semuanya Jaga kesehatan Jaga Produktivitas,https://www.instagram.com/p/CCQ51rHlpPi,284,3
9,5,7,2020,aminuddin.maruf,Terima kasih KH Ibnu Athoillah Yusuf Pengasuh Pesantren Baitul Arqom AlIslamy juga para santri atas kesediaan dan kerjasamanya dalam pelaksanaan rapid Test Covid19  Kita semua berdoa agar keluarga besar pesantren selalu dalam keadaan sehat dan semangat dalam menjalani aktivitas  baitularqam rapidtest pondokpesantren serambi_baitularqom,https://www.instagram.com/p/CCPnvmsl1BK,537,2
9,5,7,2020,aminuddin.maruf,Menghadapi new normal pondok pesantren membutuhkan dua hal pertama memastikan santri yang baru datang ke pesantren dalam keadaan sehat dan nonreaktif virus kedua pelaksanaan protokol kesehatan yang baik dan tepat sesuai dengan arahan gugus tugas COVID19  Alhamdulillah 500 santri yang mengikuti rapid test di pesantren Baitul Arqom Kabupaten Bandung keseluruhannya nonreaktif Hal ini menjadikan pesantren lebih yakin dalam melanjutkan program belajar mengajar  Semoga rahmat dan rahim Allah selalu bersama kita semua,https://www.instagram.com/p/CCPmHN3Fh8-,278,5
11,1,7,2020,aminuddin.maruf,Selamat Hari Bhayangkara ke 74  Terima kasih kepolisian Republik Indonesia atas dedikasi dan konsistensi dalam menjaga dan merawat NKRI  Kamtibmas Kondusif Masyarakat Semakin Produktif  divisihumaspolri polri polisi bhayangkara,https://www.instagram.com/p/CCFgaCGFqWb,638,16
17,29,6,2020,aminuddin.maruf,Kebahagiaan itu selalu ada saat bisa berbuat dan memberikan manfaat sekecil apapun kepada sesama  pesantrendevelopment ambilperan salingjaga,https://www.instagram.com/p/CCA_ejSFz7A,443,5
22,28,6,2020,aminuddin.maruf,,https://www.instagram.com/p/CB--pBvFSJO,255,2
20,28,6,2020,aminuddin.maruf,situasi ini tidak normal harus dengan cara2 luar biasa jangan mengerjakan hanya rutinitas program rakyat menunggu kita,https://www.instagram.com/p/CB-wKORlAaM,614,11
17,28,6,2020,aminuddin.maruf,Bismillah ikhtiar memutus rantai penyebaran Covid19 di lingkungan ponpes,https://www.instagram.com/p/CB-bou0FmkW,1481,12
11,21,6,2020,aminuddin.maruf,Selamat ultah Presiden jokowi ke 59th semoga Alloh selalu memberikan kekuatan utk istiqomah memperjuangkan cita2 bangsa Berkah selalu panjang umur dalam sehat,https://www.instagram.com/p/CBrzwDxlMke,2357,14
19,10,6,2020,aminuddin.maruf,Cantik kan Alloh sayang Alloh jaga anakku,https://www.instagram.com/p/CBQUNe3FY9o,720,6
12,4,6,2020,aminuddin.maruf,Beribadah dengan khusyu dan aman sudah rindu sholat di masjid ini,https://www.instagram.com/p/CBAGy4oFOlK,162,5
13,1,6,2020,aminuddin.maruf,Pancasila adalah ruh dan kita anak muda adalah jasad yang bergerak atas falsafah dan nilainilainya  Selamat Hari Lahir Pancasila  pancasila harilahirpancasila,https://www.instagram.com/p/CA4dkyBFP49,442,1
0,26,5,2020,aminuddin.maruf,terus bergerak teman2 gerakan bagigaji banyak hal yg masih perlu diperjuangkan mereka menunggu dan berharap,https://www.instagram.com/p/CAnoeEJF7oN,319,4
17,25,5,2020,aminuddin.maruf,Lebaran hari kedua kalian gimana Ayo kita seru2an  Ini hari lebaran kedua kami ya idulfitridirumahaja ga kalah serunya loooh Apalagi kalo dipoto dengan gaya keren begini lewat photoshoot online lg keeeren kaaan  Makasih ya sweetescape potonya keren2 buangettt ,https://www.instagram.com/p/CAm5sKvlxJ1,1349,11
12,25,5,2020,aminuddin.maruf,jangan ada ampun utk pengedar narkotika ancaman nyata utk generasi penerus bangsa,https://www.instagram.com/p/CAmXGz-FtLW,373,20
23,24,5,2020,aminuddin.maruf,Lebaran tahun ini tanpa mudik tanpa baju baru  alhamdulillah masih dengan orang2 tersayang Mohon maaf lahir batin ,https://www.instagram.com/p/CAk_JsXFSuy,2722,23
22,23,5,2020,aminuddin.maruf,Ramadhan adalah madrasah penuh dengan amaliah yg mengandung pelajaran utk diterapakan pada bulan2 berikutnya,https://www.instagram.com/p/CAiNZUTltfI,539,4
21,23,5,2020,aminuddin.maruf,Selamat berlebaran merayakan kemenangan tentu dengan suasana yg sangat berbeda Suasana yg hanya bisa dihentikan oleh gotong royong kita semua dg kesadaran diri utk saling menjaga tetap di rumah menggunakan protokol covid19  Semoga ibadah ramadhan kita tahun ini menjadi pelajaran bekal kita setahun ke depan  Allohu Akbar  Allohu Akbar Allohu Akbar Allohuakbar wa Lillahi alhamd  Minal aidin wal faidzin kullu aam wa antum bi khoir Mohon maaf lahir dan batin,https://www.instagram.com/p/CAiLcA6lr7n,511,8
13,23,5,2020,aminuddin.maruf,Mari sambut kemenangan hari raya idul fitri dengan suka cita dengan cara yg berbeda pengorbanan kita untuk tidak mudik di lebaran kali ini semoga diganti dengan segera berakhirnya pandemi covid19 dr bumi pertiwi,https://www.instagram.com/p/CAhRAGAFP_e,307,3
21,21,5,2020,aminuddin.maruf,,https://www.instagram.com/p/CAc-hwAFDFW,892,30
14,21,5,2020,aminuddin.maruf,Di hari2 akhir ramadhan teruslah berbagi dg sesama sedikit utk kita mungkin sangat berarti bagi mereka Terimakasih sahabat2 dr gerakan bagigaji yg terus bergerak bergotong royong utk ikut andil dalam penanganan wabah pandemi covid19,https://www.instagram.com/p/CAcQVCFF7re,259,0
21,20,5,2020,aminuddin.maruf,Segera diumumkan pemenang lomba ramadhanproduktifditengahcovid,https://www.instagram.com/p/CAaezAol0Ub,1295,57
16,20,5,2020,aminuddin.maruf,Terimakasih teman2 gerakan bagigaji yg terus bergerak berbuat utk masyarakat terdampak covid19,https://www.instagram.com/p/CAZ3vTcF82p,143,1
14,20,5,2020,aminuddin.maruf,Selamat Hari Kebangkitan Nasional  20 Mei 1908 anak bangsa menyepakati untuk bangkit bersatu memperjuangkan kemerdekaan republik  20 Mei 2020 anak bangsa berusaha sekuat tenaga mempertahankan nilai kemerdekaan melalui solidaritas sosial bahu membahu mengatasi pandemi COVID19  Mari tunjukkan patriotisme kita dengan saling jaga saling bantu dan juga tundamudik sambil terus menjaga kesehatan,https://www.instagram.com/p/CAZrqMclian,724,7
1,20,5,2020,aminuddin.maruf,Gerakan bagigaji terus berbuat utk membantu meringankan beban masyarakat yg terdampak dari adanya musibah pandemi covid19 Terimakasih kepada semua yg telah menyumbangkan sebagian penghasilannya lewat gerakan bagigaji,https://www.instagram.com/p/CAYRWQ4loVO,1180,10
21,19,5,2020,aminuddin.maruf,Alhamdulillah masih bisa berbagi dan berbuat semampunya bersama dengan teman di gerakan bagigaji,https://www.instagram.com/p/CAX51LAFQ36,242,5
4,19,5,2020,aminuddin.maruf,Alhamdulillah bisa berbagi bersama dengan temen2 bagigaji,https://www.instagram.com/p/CAWBxqblCVq,480,6
10,16,5,2020,aminuddin.maruf,Presiden menginginkan masyarakat tetap produktif dan juga aman dari covid,https://www.instagram.com/p/CAO8imGF8I_,211,1
21,15,5,2020,aminuddin.maruf,UntukMu puasaku dan atas rejekiMu kami berbuka,https://www.instagram.com/p/CANg0_uFTfC,556,9
18,15,5,2020,aminuddin.maruf,Berbagi ada kenikmatan dirasa Semampunya seikhlasnya,https://www.instagram.com/p/CANSuUDlb6m,2606,20
4,15,5,2020,aminuddin.maruf,Waah banyak juga ya yg ikut kalian luar biasa bukti bahwa covid19 dan ibadah puasa bukan sebagai penghalang utk kita tetap produktif Selanjutnya tinggal dewan juri yg menentukan,https://www.instagram.com/p/CALvf_9lh8b,1281,28
3,12,5,2020,aminuddin.maruf,tulisan keren dr anak2 muda keren semoga bermanfaat,https://www.instagram.com/p/CAD3eiiFX4y,485,8
23,7,5,2020,aminuddin.maruf,sayangi orang tua dan keluarga kita di kampung halaman dengan tetap disini ya jangan pulang dulu utk memutus rantai penyebaran covid19,https://www.instagram.com/p/B_5LIWzlhIE,711,12
13,7,5,2020,aminuddin.maruf,Disiplin adalah kunci utk kita keluar dr pandemi ini,https://www.instagram.com/p/B_4Gy63l34e,165,1
4,6,5,2020,aminuddin.maruf,Siang menjelang sore nanti insya alloh saya akan belajar bareng dengan para senior yg keren ada Bang sandiuno Mas danielzuchron dan Kang fitriadiyus,https://www.instagram.com/p/B_0hFreFByB,491,10
19,2,5,2020,aminuddin.maruf,Mengenang Guru Zuhdi Allohu Yarham Alfatiha ila KH Ahmad Zuhdiannoor,https://www.instagram.com/p/B_r12MUFH5h,722,8
13,2,5,2020,aminuddin.maruf,Selamat hari pendidikan nasional Tuhan Pun telah berjanji akan mengangkat derajat kalian yg berilmu,https://www.instagram.com/p/B_rNw16FCtt,432,3
12,2,5,2020,aminuddin.maruf,Innalillahi wa inna ilaihi rojiun Indonesia kehilangan ulama kharismatik asal Kalimantan Selatan beliau biasa disebut Guru Zuhdi KH Ahmad Zuhdiannoor Alfatiha,https://www.instagram.com/p/B_rIc6oFb9p,1081,10
12,2,5,2020,aminuddin.maruf,Pemuda Muhammadiyah salah satu organisasi yg lebih dulu ada sebelum republik ini berdiri Penyangga kokoh bangunan kebhinekaan Yaumul Milad utk sahabat2 kami Pemuda Muhammadiyah ke 88th pppemudamuhammadiyah caknanto,https://www.instagram.com/p/B_rHm9DlG-S,448,2
9,1,5,2020,aminuddin.maruf,Selamat hari buruh internasional utk kaum buruh kawan seperjuangan kami,https://www.instagram.com/p/B_oP8fcFEYg,1010,6
16,29,4,2020,aminuddin.maruf,teman2 dr bagigaji terus menyalurkan bantuan kepada warga terdampak dr pandemi covid19,https://www.instagram.com/p/B_jwlNplzDW,184,0
14,29,4,2020,aminuddin.maruf,Berbagi di Bulan Suci lewat bagigaji,https://www.instagram.com/p/B_jpDnRli7Y,502,12
22,28,4,2020,aminuddin.maruf,Ini utk kalian mahasiswa kece Jadikan Ramadhan mu lebih produktif ya,https://www.instagram.com/p/B_h3qOtlL2_,1207,57
22,28,4,2020,aminuddin.maruf,Ini juga utk kamu para santri Jadikan Ramadhan kita lebih produktif ya,https://www.instagram.com/p/B_h3VNqlJkL,1081,40
22,28,4,2020,aminuddin.maruf,Untuk para santri ikutan yuuuk Biar Ramadhan kita lebih produktif,https://www.instagram.com/p/B_h21-klj0Y,839,31
7,21,4,2020,aminuddin.maruf,Untuk kalian semua manusia pilihan Tuhan yg dianugerahkan sebagai perempuan khususnya perempuan indonesia Berdayakan dirimu menjadi kuat jika kamu kuat akan lebih mudah utk menolong orang lain,https://www.instagram.com/p/B_OTXRXFDvK,415,2
0,17,4,2020,aminuddin.maruf,Di rumah ini aku dibesarkan  Selamat harlah PMII ke 60th Ilmu dan bakti kuberikan adil dan makmur kuperjuangkan Salam Pergerakan,https://www.instagram.com/p/B_DKphSFFwl,2657,82
8,12,4,2020,aminuddin.maruf,Malam nanti saatnya batin yg menerima gizi Seperti tubuh yg perlu nutrisi vitamin dan asupan makanan yg baik untuk menjaga imun tetap kuat di dalam tubuh  Malam ini kita akan berdzikir bersholawat yg dipandu guru saya Gus hafidhakiem pimpinan majelis syubbanulmuslimin  tausiah insya alloh disampaikan Almukarom KH Yusuf Chudlory yusuf_ch tentunya masih bersama Mas Bos ferroferizka,https://www.instagram.com/p/B-3PIn7FU_H,492,4
10,10,4,2020,aminuddin.maruf,Temen2 yang merayakan tentunya dr rumah masing2 ya selamat merayakan jumat agung Kita berdoa semoga Tuhan segera menghilangkan makhluknya yg diberi nama covid19 dr planet bumi khususnya dr ibu pertiwi  Jangan lupa tetep DiRumahAja dan bagi kalian yg terpaksa harus keluar rumah selalu pake maskeruntuksemua,https://www.instagram.com/p/B-yN33mlqUx,231,1
