Jam,Tanggal,Bulan,Tahun,Username,Caption,Link,Like,Komentar
10,7,4,2020,aminuddin.maruf,Keadaan memaksa kita merubah kebiasaan Tanpa sadar naluri manusia adalah terus bergerak dan berubah Bergerak walaupun hanya dr rumah ingat dulu ungkapan dr kyai  saya tdk ada dimana2 tp saya ada dimana2 Nah bingung kan lo Kira2 kalo zaman now kalimat itu ada pada diri anak2 muda keren spt gus romziahmad mas bos fahdpahdepie dan nyai an2aminah yg selalu merasa Abege terus hahaha  Udeh ga usah panjang2 ye ntar malem aja kita ngobrolnya,https://www.instagram.com/p/B-qinnrFYzf,717,8
10,4,4,2020,aminuddin.maruf,Jangan Keluar Jangan Ketemu dulu ya kite di rumah aje tuh kata mas ananghijau dan mbakyu ashanty_ash,https://www.instagram.com/p/B-iykE3FPdj,706,9
22,3,4,2020,aminuddin.maruf,Tenang dan Sabar,https://www.instagram.com/p/B-hitDulrzH,368,4
9,2,4,2020,aminuddin.maruf,Ilmuwan dan Agamawan dua golongan yg saling melengkapi Imuwan membahas cosmos yg paling besar hingga virus yg sangat kecil seperti covid19 Agamawan membantu pikiran dan perasaan manusia gg halus dan lembut untuk terhubung dg dzat yg maha lembut alhalim dan maha halus allatif  Bila paramedis berjuang menemukan vaksin covid19 Agamawan berjuang dg memohon kpd Allah agar diberi keselamatan utk semua umat manusia Di dalam pelajaran agama ada mekanisme berdoa sebagaimana dalam medis ada mekanisme penelitian ilmiah Buya Said  Ya Alloh jagalah kami lindungilah negeri kami,https://www.instagram.com/p/B-dlSPilDh8,421,8
20,26,3,2020,aminuddin.maruf,DiRumahAja tp tetep produktif Emangnya bisa Niiih tipsnya dari bnpb_indonesia,https://www.instagram.com/p/B-MvRxClsuX,209,9
16,26,3,2020,aminuddin.maruf,Semoga Alloh selalu memberikan kekuatan kesabaran kesehatan untukmu Pa Di tengah begitu banyak terpaan masalah kepada Bangsa yg sedang kau pimpin kepergian Ibunda pasti sangat memukul siapapun Doa kami selalu menyertai semoga kuat memimpin negeri ini dan semoga Almarhumah diterima di tempat yg terbaik di sisiNya Alfatiha,https://www.instagram.com/p/B-MQLZAl4pj,2684,48
17,25,3,2020,aminuddin.maruf,Allohummaghfirlaha ya Alloh Insya Alloh Husnul Khotimah Alfatiha,https://www.instagram.com/p/B-J3NMalAya,917,10
16,25,3,2020,aminuddin.maruf,Menyepi untuk menang Selamat hari raya suci Nyepi untuk saudara2ku yg memperingati Kita doakan semoga Indonesia segera menang melawan cofid19,https://www.instagram.com/p/B-Juuzzlel6,340,0
0,24,3,2020,aminuddin.maruf,Tenaga medis  dokter perawat dan yg bertugas di RS semoga Alloh selalu menjaga memberikan kekuatan untuk terus sebagai pahlawan bangsa yg telah gugur insya alloh husnul khotimah,https://www.instagram.com/p/B-FPo80lZbO,428,8
19,23,3,2020,aminuddin.maruf,Bersatu padu lawancovid19,https://www.instagram.com/p/B-E4LXhlJRX,333,1
16,20,3,2020,aminuddin.maruf,Bersatu padu melawan covid19,https://www.instagram.com/p/B9818baFn4J,194,0
19,19,3,2020,aminuddin.maruf,Yuk kita sama2 lawancovid19,https://www.instagram.com/p/B96lPzrl2Ls,635,10
16,19,3,2020,aminuddin.maruf,BersatuMelawanCovid19,https://www.instagram.com/p/B96N1HxlRW9,130,0
23,16,3,2020,aminuddin.maruf,Arahan presiden jokowi  yuk digeser ya gaesss,https://www.instagram.com/p/B9zP87lFAZ-,517,4
16,16,3,2020,aminuddin.maruf,Kebijakan lockdown baik tingkat pusat maupun daerah adalah kewenangan pemerintah pusat,https://www.instagram.com/p/B9yknSUF4vB,221,3
16,15,3,2020,aminuddin.maruf,stayhome,https://www.instagram.com/p/B9v8n7xFSEw,249,3
14,12,3,2020,aminuddin.maruf,Jika ikhtiar sudah maksimal dilakukan bersimpuh berdoa memohon lindunganMu bersholawat kepada RosulMu,https://www.instagram.com/p/B9oAoq6FCDf,172,3
14,8,3,2020,aminuddin.maruf,Selamat hari perempuan internasional ya ,https://www.instagram.com/p/B9dv_I2FEJ8,918,6
20,5,3,2020,aminuddin.maruf,Jangan pernah takut waspada wajib,https://www.instagram.com/p/B9WoaQNFhTc,176,0
8,4,3,2020,aminuddin.maruf,Ini formasi lengkap keluarga kecil kami Nantikan kami di tempat2 keren lainnya ya  hehe Kalian ada ide tempat selanjutnya yg harus kami datangi,https://www.instagram.com/p/B9SwBNulIKn,1510,21
18,3,3,2020,aminuddin.maruf,Aku dan Andara maminya kemana Nanti ya di postingan selanjutnya ,https://www.instagram.com/p/B9RR7SIlXX4,2076,23
18,2,3,2020,aminuddin.maruf,Alhamdulillah berkesempatan silaturahim ke Ponpes Manbaul Ulum Banyuwangi ketemu Gus hidayatullahhasan disini padahal beliau tinggal di karawang Gus Hasan salah satu dzurriyat Almaghfurlah Kyai Askandar pendiri ponpes Manbaul Ulum  Dalam sambutan sebagai tuan rumah Gus hidayatullahhasan menyampaikan bahwa ponpes Manbaul Ulum didirikan tahun 1937 oleh kakek beliau Kyai Askandar Karena didirikan lebih dulu dr berdirinya Republik Indonesia Gus Hasan menjelaskan sejarah panjang perjuangan para kyai santri dan pondok pesantren dalam merebut kemerdekaan dan ikut mendirikan Negara Kesatuan Republik Indonesia  Gus Hasan yg juga Ketua PWNU Jawa Barat ini meneruskan penjelasannya mengenai pondok pesantren sebagai salah satu komponen yg mendirikan republik ini sudah sepantasnya negara memberikan perhatian lebih karena pesantren adalah salah satu pemilik dan pemegang saham NKRI  Intinya Gus hidayatullahhasan menyampaikan ada darah dan keringat kyai dan santri dalam merebut dan mempertahankan kemerdekaan bangsa ini  Tiba giliran saya menyampaikan sedikit pemikiran saya di hadapan para pengasuh ponpes dan santri Kira2 apa yg saya sampaikan terkait sambutan Gus Hasan tadi ya,https://www.instagram.com/p/B9OtUSslFsj,746,7
18,1,3,2020,aminuddin.maruf,Pagi tadi saya berkunjung ke Ponpes Darussalam Blokagung kebetulan di pondok sedang ada pengajian bulanan minggu legi yg diikuti santri alumni dan masyarakat  Saya manfaatkan utk berbincang dg beberapa orang santri mereka ada yg berasal dr bone sulawesi selatan dr kab luwuk sulwaesi tengah tentunya banyak juga dr tuan rumah jawa timur Diantara mereka selepas mondok di darussalam ada yg berkeinginan kuliah di fak kedokteran pertanian keagamaan Cita2 mereka pun beragam dari menjadi dokter pengusaha petani dosen smp ingin menjadi kyai  Santri sebagaimana anak indonesia lainnya yg hari ini sedang mengenyam pendidikan dasar dan menengah adalah mereka yg akan menjadi pelaku sejarah satu abad indonesia yg digadang2 sebagai generasi emas indonesia,https://www.instagram.com/p/B9MKrYUlKXh,1053,7
20,29,2,2020,aminuddin.maruf,Ada yg tau ini dimana  Kata kuncinya  salah satu wilayah di daerah ujung pulau jawa yg beberapa tahun belakangan lagi hits banget dengan segala kreatifitas dan inovasinya  Tidak hanya menjual keindahan alamnya daerah ini bisa dikatakan sebagai tempatnya event2 terutama seni budaya dan pariwisata  Bupatinya juga seorang aktifis bukti bahwa aktifis mampu mentransformasi daerah dr yg tidak banyak dikenal menjadi daerah yg membuat banyak orang penasaran ingin datang berkunjung  Apakah transformasi daerah ini datang dengan sendirinya Dalam waktu yg singkat Ya gak butuh pemimpin visoner dan konsisten utk merubah sebuah wilayah Butuh perangkat daerah yg responsif dan kreatif Butuh perencanaan jangka panjang utk melaksanakan pembangunan berkelanjutan Yg tidak kalah penting juga butuh dukungan dr semua elemen masyarakat,https://www.instagram.com/p/B9Jv1Qxl2cU,1193,27
14,29,2,2020,aminuddin.maruf,Pesan yg sesuai dengan foto ini  1 Semut di sebrang lautan nampak jelas kelihatan gajah di pelupuk mata tidak terlihat__  2 Nikmat Tuhan mana lagi yang kau dustakan__  3 Bangun tidur ku terus mandi syalalala__  Menurut kalian piye gaesss   Foto ini diambil oleh profesional catyaluna wonderfullbanyuwangi,https://www.instagram.com/p/B9JIx3GF4ZG,980,14
12,29,2,2020,aminuddin.maruf,Bondowoso semalam  munajat dzikir sholawat sebagai bagian ritual mendekatkan diri kepada Robbul alamin Dalam kesempatan itu juga saya menyampaikan mengenai program prioritas sebagai turunan dari visi Presiden jokowi khususnya di bidang sumberdaya manusia  Hari ini tdk lg ada alasan tidak mampu karena biaya bagi anak2 indonesia untuk mengenyam pendidikan Pemerintah ingin memastikan generasi emas indonesia menjadi pelaku utama  sebagai pemimpin teknokrat enterpreneur akademisi dsb yg memiliki kualitas dan daya saing yg kompetitif Semua hanya bisa diciptakan melalui proses pendidikan  Selanjutnya saya ke banyuwangi utk beberapa kegiatan misinya masih soal menebar optimisme anak muda indonesia,https://www.instagram.com/p/B9I2fZAlUdV,1207,10
12,28,2,2020,aminuddin.maruf,Semalam berkesempatan silaturahim dan sedikit berbagi pengalaman dengan santri ponpes sofa marwa jember pimpinan orang tua kami Prof KH Halim Subahar  Saya dapet surat dari salah satu santri yang isinya curahan hati kepada Presiden jokowi insya alloh saya akan sampaikan  Teruslah bermimpi bercitacita tinggi untuk masa depan kalian masa depan umat masa depan jamiyyah Mimpi kalian harus diikuti dengan semangat belajar tidak ada yg tidak bisa yg ada hanya mau atau tidak,https://www.instagram.com/p/B9GWPx7lIIn,1188,4
7,28,2,2020,aminuddin.maruf,Keunggulan yg menjadi daya saing santri salah satunya adalah kemampuan kerjasama tim yg sangat bagus karena dididik sejak dini di pondok pesantren dengan kebersamaan Sangat compatible dengan tantangan hari ini di semua sektor dan spesialisasi peran yg mengharuskan berkolaborasi  Apakah cukup dengan kemampuan kolaboratif yg dimiliki santri untuk menjawab tantangan masa depan Tidak akan cukup Santri harus punya kemampuan adaptif inovatif kreatif untuk berdaya saing dan masuk dalam kategori sumberdaya manusia unggul  Kemarin saya berkunjung ke ponpes nurul qadim di paiton probolinggo Bersama dengan pimpinan ponpes Kyai elhadi7565 saya menyampaikan kepada santriwati mengenai visi presiden jokowi dalam bidang sumberdaya manusia  Santri yg hari ini sedang berproses di ponpes mereka masuk dalam kategori generasi z dengan segala karakteristiknya Generasi yg haus akan pembaharuan dan penuh dengan kreatifitas juga generasi yg menginginkan segalanya serba cepat dan mudah Mereka ada di jaman yg berbeda dunia yg sudah sangat terbuka dengan arus informasi dan kemajuan teknologi utk mempersiapkan mereka menjadi generasi emas indonesia 2045 tidak ada kata lain selain pendidikan  Semangat taswirul afkar harus menjadi spirit ponpes sebagai khidmat kepada bangsa dalam mempersiapkan sumberdaya manusia unggul Ya spirit taswirul afkar untuk penciptaan sumberdaya manusia berkualitas akan mendorong kita mewujudkan kemandirian ekonomi umat dan ponpes dalam tahapan selanjutnya,https://www.instagram.com/p/B9F0ThklU6w,1827,29
16,24,2,2020,aminuddin.maruf,Sektor Kelautan dan Perikanan akan sangat menentukan utk menekan laju urbanisasi pemerataan dan percepatan pembangunan ekonomi juga pemerataan pendapatan  Saya berdiskusi dengan Menteri Kelautan dan Perikanan bagaimana ponpes bisa menjadi pusat kegiatan ekonomi di sektor perikanan dan kelautan begitu juga anak2 muda kreatif untuk bisa memanfaatkan potensi ekonomi di bidang tsb  Terimakasih Pa edhyprabowo diskusi siang yg mencerahkan ,https://www.instagram.com/p/B88brk5FlKQ,1382,20
14,21,2,2020,aminuddin.maruf,Sholat jumat tadi saya tertarik mengambil foto ini karena bahasan khotibnya tidak seperti biasanya Saya sudah sholat jumat disini dari sekitar 2th yg lalu dan baru di sholat jumat hari ini saya mendengarkan khotibnya bicara tentang relasi islam dan pancasila  Sang khotib menjelaskan panjang lebar baik dr sisi argumentasi teologis sosiologis historis dan yuridis bagaimana relasi islam dan pancasila  Intinya khotib menyampaikan bahwa nilai2 pancasila itu tidak ada yg bertentangan dengan islam bahkan lebih dr itu bahwa sumber dari pancasila itu dengan sangat mudah kita temukan di ayat2 yg ada dalam alquran  Mari merawat pancasila yg dilahirkan salah satunya oleh ulama indonesia sebagai sebuah maha karya untuk jalan hidup kita sebagai warga negara Menjadi muslim yg baik dan benar sudah pasti menjadi warga negara yg baik dan benar juga,https://www.instagram.com/p/B80ezPDFbe0,707,10
21,18,2,2020,aminuddin.maruf,Kami adalah sahabat  Tidak ada koma yg ada hanya titik Ngerti kan,https://www.instagram.com/p/B8ticZcFYYm,1240,10
20,16,2,2020,aminuddin.maruf,Weekend kalian gimana gaesss Setelah sepekan disibukan urusan kerjaan saya selalu menyempatkan paling tidak keluar makan malam bersama keluarga  Sekarang anakku Andara sudah protes kalo weekend papinya masih tetap keluar rumah rupanya dia sudah tau kalo weekend itu hari libur  Tugas saya tak mengenal hari sabtuminggu sekalipun saya masih sering keluar utk memenuhi undangan diskusi atau pertemuan Setelah itu barulah janjian dg maminya andara ketemu di luar kalo memang saya tdk bisa berangkat bareng dr rumah,https://www.instagram.com/p/B8oUJhxF-2s,1159,14
18,15,2,2020,aminuddin.maruf,Bagaimana melaksanakan pembangunan berkelanjutan yg merata dan adil Dimana peran staf khusus presiden dari generasi millenial untuk memastikan distribusi pemerataan itu Bagaimana pesantren dan desa bisa menjadi fasilitator untuk menahan laju urbanisasi Dan masih banyak pertanyaan yg menjadi bahan diskusi menarik kami tadi siang di talkidebagus bersama salah satu senior gerakan yg kerennya ga habis2 Mas budimansudjatmikochannel,https://www.instagram.com/p/B8lhpm4Fe7V,1169,13
21,13,2,2020,aminuddin.maruf,Sore tadi kami silaturahim dengan Rektor Univ Islam Negeri Syarif Hidayatulloh Jakarta Prof Dr Hj Amany Burhanuddin Umar Lubis Lc MA  Kami berdialog mengenai isu2 moderasi beragama inovasi kampus kreatifitas mahasiswa sampai persoalan geopolitik timur tengah yang memang menjadi kajian yg beliau kuasai  Beliau dengan senang hati bersedia membantu memberikan masukan utk tugas2 yg sedang dan akan kami kerjakan  Terimakasih Prof perempuan hebat yg banyak menerima penghargaan baik dr dalam maupun luar negeri,https://www.instagram.com/p/B8grxndF_7f,1089,1
23,9,2,2020,aminuddin.maruf,Teruslah menjadi pilar demokrasi yg kokoh mencerdaskan menggelorakan semangat optimisime anak bangsa  Goresan pena itu harus tetap tajam tp tak membelah menusuk ke dalam untuk menyatukan Selamat hari pers nasional utk sahabat2ku insan pers penamu adalah mata dan telinga rakyat,https://www.instagram.com/p/B8WjZgWF67G,868,6
21,8,2,2020,aminuddin.maruf,Selain acaranya keren foto2nya juga keren orangnya aja yg kurang keren ,https://www.instagram.com/p/B8TyzPUFeDe,1294,22
19,8,2,2020,aminuddin.maruf,Dua kata apa yg tepat untuk foto2 ini Menurut saya keseruan dan kekompakan Kalo menurut kamu  Terimakasih creativepreneurec sdh bikin acara yg keren banget  Thanks juga jepretan yg kece ini saya dapet dari temen2 koalskyexe fahmifahim_ kromosom_,https://www.instagram.com/p/B8Ti66YFfsR,729,3
18,7,2,2020,aminuddin.maruf,Ngebolang bersama si rempong Taufan  billymambrasar putri_tanjung ke banjarmasin Sebelum besok nemenin Pabos Presiden malem ini kita ngopi santuy dulu sama anak2 muda keren,https://www.instagram.com/p/B8Q5kMAlcN9,1821,19
9,7,2,2020,aminuddin.maruf,Alhamdulillah kemarin saya berkesempatan silaturahim dg teman2 di sekretariat kammipusat yg baru saja terpilih dalam Muktamar di Malang beberapa waktu lalu  Banyak hal kami diskusikan tentang persoalan tantangan organisasi mahasiswa ekstra kampus Saya merasakan betul bagaimana susahnya berjuang dan berproses untuk membesarkan organisasi dengan cakupan wilayah yg sangat luas  Kita dihadapkan dengan fakta bahwa mengurus organisasi sebesar KAMMI memerlukan sumberdaya yg tidak sedikit dan harus tetap menjaga semangat idealisme gerakan mahasiswa Lalu bagaimana solusinya Disitulah kita ditempa menjadi manusia tangguh kader unggul generasi yg siap menerima mandat estafet regenerasi bangsa  Dengan proses yg sudah kita jalani dg kontribusi yg tidak sedikit utk mendidik generasi muda bangsa saya sedang memperjuangkan afirmasi negara utk kalian yg sudah mengeluarkan keringat tanpa ada imbalan apapun,https://www.instagram.com/p/B8P-f1gF_OV,778,4
22,6,2,2020,aminuddin.maruf,Halo Banjarmasin  Insya Alloh besok kami putri_tanjung billymambrasar dan bos amarthaid ngajak ngopi kamu ya kamu anak2 muda Banjarmasin kita berbagi ide untuk indonesia lebih keren  Kalian berbicara kami mendengar,https://www.instagram.com/p/B8OxfNHFQKu,768,10
13,6,2,2020,aminuddin.maruf,Semoga Husnul Khotimah Ka Bagdja  2004 pertama ketemu alm Ka Bagdja Ya waktu itu saya dan sahabat2 pmiiunj baru saja selesai mengikuti mapaba Kami diajak Ka eisthianti sebagai ketua komisariat bertemu dengan alm  Pesan beliau saat itu yg smp skrg saya ingat betul adalah lakukan yg terbaik utk PMII insya alloh PMII akan memberikan yg terbaik untuk kamu  Almagfurlah Kyai Bagdja Ketum pbpmii_official 19771981 Sekjen nahdlatululama 19891994 sangat lembut dan ramah kepada semua kader tak pernah marah sangat sederhana  Kami bersaksi Ka Bagdja orang baik Alfatiha,https://www.instagram.com/p/B8N0mp6lLcJ,1820,13
15,5,2,2020,aminuddin.maruf,Baru saja Presiden jokowi mengambil sumpah jabatan Prof Yudian sebagai Kepala BPIP Tugas berat menanti untuk membumikan nilainilai pancasila Selamat Prof ,https://www.instagram.com/p/B8Ld37klFKf,1718,10
13,5,2,2020,aminuddin.maruf,Selamat Milad 73th Himpunan Mahasiswa Islam Teruslah menjadi laboratorium pencipta generasi kepemimpinan bangsa Yakin Usaha Sampai Barokalloh,https://www.instagram.com/p/B8LK3spFvun,1099,9
9,5,2,2020,aminuddin.maruf,Diperintah bos billymambrasar ngisi diskusi sahabat2 papuainspiratif bicara soal toleransi dan papua Smp ktm nanti malem ya,https://www.instagram.com/p/B8K0svhl66T,583,5
18,3,2,2020,aminuddin.maruf,Kegiatan hari ini bersama Pabos Presiden,https://www.instagram.com/p/B8GmPNtFdOq,1492,7
0,3,2,2020,aminuddin.maruf,Insya Alloh Husnul Khotimah Gus Alfatiha,https://www.instagram.com/p/B8EqLxnFtkY,447,5
17,2,2,2020,aminuddin.maruf,Ini namanya gaya menara pisa miring miring cantik hehe,https://www.instagram.com/p/B8D6-TUl3D5,1148,4
13,2,2,2020,aminuddin.maruf,Pose gini oke ga gaesss ,https://www.instagram.com/p/B8DgBNdlSXW,755,3
20,1,2,2020,aminuddin.maruf,Dari jatim langsung ke bogor Main dulu sama Andara Kalo mau jadi orang tersohor Jangan lupa sama keluarga  Malam ini jalan ke bogor Malam minggu malam yang panjang Datang diundang acara ansor Ayo semua sahabat kita berjuang,https://www.instagram.com/p/B8Bqew8Fz4j,2749,23
19,31,1,2020,aminuddin.maruf,Jokotole collection Batik Gentong Khas Bangkalan Madura,https://www.instagram.com/p/B7_BXEpFHtv,542,7
6,31,1,2020,aminuddin.maruf,Di momentum harlah tahun ini Alhmdlh saya berkesempatan bercerita dan laporan langsung dg para muassis jamiyyah nahdlatululama  Mulai dr Makbaroh Syaikhona Kholil di Bangkalan Hadratussyeikh Mbah Hasyim di Tebuireng Mbah Wahab di Tambakberas Mbah Bisri di Denanyar Kyai Romli Tamim di Peterongan  Selamat Harlah 94 nahdlatululama kami bangga menjadi NU dan Indonesia,https://www.instagram.com/p/B79l6iflsi1,1290,8
22,30,1,2020,aminuddin.maruf,Siang tadi curhat kepada Mbah Hasyim Kyai Wahid Hasyim Gusdur dan dzurriyat ponpes tebuireng di makbaroh,https://www.instagram.com/p/B78wIGWlcxo,1356,4
19,30,1,2020,aminuddin.maruf,Saat sowan ke ponpes pondoknjoso tadi pagi saya sungkem ke Ibu Nyai Saat itu juga pikiran saya langsung lari ke kampung inget ibuku  Semoga Alloh memberikan panjang umur kepada Ibu Nyai Ibuku Istriku perempuan hebat yg selalu menjaga dan mendoakanku,https://www.instagram.com/p/B78YH1ul5jW,1558,20
5,29,1,2020,aminuddin.maruf,Keseruan rapat kemarin dipimpin langsung oleh sang komandan staf khusus presiden Bli dwipayanaari  Kira2 kalo tiga gugus tugas yg ada di tim staf khusus presiden kumpul yg kami bicarakan apa ya  Okeey hari ini meninggalkan jakarta dulu smp hari jumat Kali ini saya akan mengunjungi surabaya bangkalan dan jombang Bismillah,https://www.instagram.com/p/B74TofUl3ol,1209,6
14,28,1,2020,aminuddin.maruf,Banyak banget hal menarik yg kami diskusikan mengenai peluang kolaborasi kami dengan Microsoft Indonesia khususnya pengembangan teknologi pesantren dan ekonomi kreatif desa  Terimakasih Bu Mulia Dewi Chief Partner Officer Microsoft Indonesia yg sudah menyatakan kesediaannya untuk mendukung ide2 kami Mas Bos ferroferizka thenkyu juga ,https://www.instagram.com/p/B72vzhOFIqx,1338,7
19,24,1,2020,aminuddin.maruf,Dari kecil saya sudah banyak berinteraksi dengan saudara2 kita etnis tionghoa Orang tua sering mengajak saya belanja barang dagangan warung ke Rengasdengklok saya main sama anak yg punya toko itu  Selesai kuliah tahun 2009 saya diajak kerja oleh salah satu anggota DPD RI bos saya itu juga dr etnis tionghoa dr belitung Saya memanggilnya Ko Tellie Bukan hanya sebagai bos hubungan saya dengan Ko Tellie sudah seperti keluarga Mulai dr belajar kerja sampai saya didorong untuk membuat perusahaan sebagai awal saya berwirausaha mandiri  Dari urusan pribadi persahabatan smp urusan bisnis saya banyak berinteraksi dengan etnis tionghoa Satu yg paling berkesan untuk saya kerja keras yg luar biasa sebagai prinsip hidup saya dapat dr mereka  Selamat Tahun Baru Imlek 25712020 Gong Xi Fa Cai semoga segala keburuntungan dan keselamatan senantiasa menyertai kita,https://www.instagram.com/p/B7s97a_l4rM,640,4
0,24,1,2020,aminuddin.maruf,4 tahun yg lalu waktu akad nikah kami beliau yg menyampaikan pesan2 pernikahan  Nama Andara Izza Nahdliyah juga beliau yg memberikan karena lahir bertepatan dengan harlah NU Alhamdulillah malam ini kami bisa silaturahim Bercerita banyak hal dr urusan keluarga smp hal yg berkaitan dengan kebangsaan,https://www.instagram.com/p/B7q9aJQFZRm,2390,9
12,22,1,2020,aminuddin.maruf,Generasi kita milenial dan gen z sebagai mayoritas dr penduduk indonesia menjadi kunci dari segala upaya yg dilakukan oleh pemerintah dalam mewujudkan indonesiamaju  Sampai ketemu ya Mas Bro achanali dijamu Mas juriardiantoro,https://www.instagram.com/p/B7nEcTHFeQZ,367,7
13,20,1,2020,aminuddin.maruf,Hari Sabtu kemarin berkesempatan menyapa anak2 muda di Bandung di acara mmefestival  Saya berbicara prediksi 2045 saat era yg dikatakan sebagai generasi emas Indonesia Saat itu diperkirakan 73 masyarakat Indonesia tinggal di wilayah perkotaan yg lebih menghwatirkan adalah sumber daya manusia unggul anak2 muda kreatif akan terkonsentrasi di kota Kota akan sangat kompetitif dan desa akan semakin sulit berdaya saing  Kita harus mulai dr sekarang untuk menahan laju urbanisasi itu dengan merubah paradigma anak muda tentang profesi petani nelayan dianggap profesi yg tak menjanjikan secara ekonomi Perikanan pertanian perkebunan ekonomi kreatif akan menjadi sektor strategis ke depan jika anak2 muda kreatif ssbagai sumberdaya manusia unggul yg menggerakan  Sudah banyak contoh anak2 muda hebat sukses menjadikan potensi lokal desa menjadi kekuatan ekonomi sebagai localpreneur,https://www.instagram.com/p/B7iBxp1l3xv,941,6
17,19,1,2020,aminuddin.maruf,Minggu sore sebelum pulang ke Jakarta Alhamdulillah saya berkesempatan bersilaturahim dengan keluarga besar PP PERSIS di Bandung  Penmberdayaan ekonomi umat pengembangan pesantren dan sumberdaya manusia radikalisme sampai tentang RUU Penghapusan Kekerasan Seksual menjadi topik diskusi yg kami bahas  Saatnya kembali ke Jakarta jangan pernah lelah mencintai Indonesia ya gaesss ,https://www.instagram.com/p/B7f2iPZFK9j,1204,10
7,19,1,2020,aminuddin.maruf,Malem mingguan bareng temen2 pimpinan organisasi kemahasiswaan Cipayung Plus Jawa Barat  Mereka juga menyampaikan afirmasi negara sangat dibutuhkan untuk pengembangan kapasitas sumber daya manusia temen2 aktifis mahasiswa khususnya dalam hal akses beasiswa utk melanjutkan jenjang studi baik di dalam maupun luar negeri Begitu juga dalam hal pemberdayaan ekonomi  Ada beberapa poin kesimpulan hasil ngopi kumpul bareng semalem salah satunya kami bersama2 akan menjalankan usaha bersama dalam sektor agro bisnis Selain untuk pemberdayaan ekonomi program ini kami harapkan juga dapat menekan laju urbanisasi,https://www.instagram.com/p/B7ezIocF4tD,685,4
18,18,1,2020,aminuddin.maruf,Seneng banget sore ini bisa silaturahim dengan temen2 santri Ponpes Baitul Arqom Pacet Bandung  Saya terus menyampaikan dalam berbagai kesempatan di ponpes peningkatan kapasitas sumberdaya manusia santri dan pesantren kunci untuk memenangkan kompetisi  Pesantren Berdaya  Santri Berprestasi  Masyarakat Sejahtera,https://www.instagram.com/p/B7dYVo6lr2y,1747,23
13,17,1,2020,aminuddin.maruf,Tadi pagi sekitar 15 jam kami menyampaikan report penugasan dr Bapak Presiden kepada kami  Saya menyampaikan beberapa poin yg menjadi tugas saya 1 Pengembangan kapasitas Pesantren baik itu secara kelembagaan sumberdaya manusia pemberdayaan ekonomi dsb sangat memerlukan afirmasi negara 2 Santri aktifis mahasiswa dan komunitas anak muda kreatif di desa harus punya porsi khusus dalam akses pendidikan dan pemberdayaan ekonomi 3 Kurang lebih ada 19 KL mempunyai program yang berkaitan dengan Pesantren Santri Mahasiswa dan Pemberdayaan pemuda desa 19 KL ini harus bersinergi untuk memberikan dampak yg lebih maksimal bagi Pesantren Santri Mahasiswa dan Pemuda Desa 4 Kami sedang menyiapkan program kecamatan berdaya untuk dijadikan pilot project sinergitas 19 KL tersebut  Yuk kita berkarya,https://www.instagram.com/p/B7aSyEKFp7n,1085,19
13,17,1,2020,aminuddin.maruf,Karena mendadak dipanggil Presiden mohon maaf untuk beberapa agenda di Tasik harus dijadwalkan ulang  Saya bersama temen2 Staf Khusus yg lain baru saja memaparkan apa saja yg sudah sedang dan akan kami kerjakan selain tentunya laporan apa yg sudah ditugaskan Presiden kepada kami,https://www.instagram.com/p/B7aP0eEF_Pp,2195,22
22,16,1,2020,aminuddin.maruf,Ketika berkeliling mengunjungi berbagai tempat apa yang selalu kalian ingat dr tempat itu  Entah ini untuk kali keberapa saya mengunjungi kota2 ini tapi saya ga pernah bosen Apalagi besok saya datang memang karena tugas saya untuk selalu berkomunikasi dengan berbagai kelompok strategis ini  Harusnya besok juga saya ada beberapa acara di tasik cuma untuk sementara masih tentatif karena besok pagi mendadak dipanggil Presiden  Sampai ketemu besok ya,https://www.instagram.com/p/B7Yp-mblWtO,1122,12
