Jam,Tanggal,Bulan,Tahun,Username,Caption,Link,Like,Komentar
19,15,1,2020,aminuddin.maruf,Hari ke2 di Tegal Alhamdulillah bisa silaturahim dg Abah Habib Lutfi Berkah berkah,https://www.instagram.com/p/B7V07uElcAK,1873,9
23,14,1,2020,aminuddin.maruf,Untuk mengelola sektor2 strategis dan negara dalam budaya kompetisi global sekarang kita tidak cukup hanya sekedar SIAP tapi juga harus MAMPU  Santri dan pesantren juga bagian dr dunia kompetisi itu Negara juga sudah hadir untuk santri dan pondok pesantren bisa berdaya saing  Selamat berkompetisi sumber daya manusia pesantren anak2 muda desa aktifis mahasiswa dan pemuda buktikan jika kita mampu TegalBrebes 14012020,https://www.instagram.com/p/B7TrgATlSsZ,983,7
6,14,1,2020,aminuddin.maruf,Terimakasih undangannya ka lathifaanshori makan malam plus diskusi yg oke banget bareng ka pranandapaloh ivanhoe_semen Bang mohaerulamri dan om ahmad_kaelani99 yg selalu keceh dan tampil milenial terus Intinya ini jaman kolaborasi jadi semua harus kompak dan bekerjasama,https://www.instagram.com/p/B7RygPIFcug,1037,8
17,13,1,2020,aminuddin.maruf,Presiden Jokowi Indonesia Berperan Penting dalam Pembentukan Energi Masa Depan Terbarukan  Indonesia turut berperan dalam membentuk energi masa depan yang terbarukan Setidaknya terdapat beberapa hal yang telah dan sedang dilakukan oleh Indonesia sebagaimana disampaikan Presiden Joko Widodo saat menyampaikan pidato kunci  pada forum Abu Dhabi Sustainability Week ADSW di Abu Dhabi National Exhibition Center ADNEC Abu Dhabi Persatuan Emirat Arab Senin 13 Januari 2020  Sebagai produsen nikel terbesar di dunia Indonesia turut berkontribusi membentuk energi masa depan khususnya di bidang penyimpanan energi Nikel merupakan salah satu komposisi penting pada sebuah baterai lithium ion dimana baterai tersebut digunakan pada ponsel pintar Jadi dalam sepuluh tahun mendatang setiap kali anda melihat ponsel pintar anda akan teringat bahwa anda membawa bagian kecil dari Indonesia di kantung dan tas anda setiap hari Itu akan mengingatkan anda pada bagian kecil dari mineral Indonesia ucap Presiden  Selain pada ponsel baterai lithium ion juga diperlukan sebagai salah satu komponen kelistrikan pada sistem transportasi misalnya mobil listrik Oleh sebab itu Presiden Jokowi mengatakan Indonesia siap untuk mensuplai kebutuhan dunia akan industri baterai lithium ion yang tumbuh dengan cepat Kami mengundang anda semua untuk bermitra dengan kami untuk membangun industri di dalam negeri untuk memproduksi komponen baterai sebagai perpanjangan hilir alami dari produksi Nikel kami ucap Presiden  Adapun sektor lain menurut Presiden dimana Indonesia berperan penting dalam pembentukan energi masa depan adalah terkait bahan bakar bio terbarukan B20 dan B30 mengingat Indonesia merupakan negara pemroduksi minyak kelapa sawit terbesar di dunia Tahun lalu kita mengimplementasikan program B20 dimana pada seluruh produk bahan bakar diesel kita harus mengandung minimal 20 persen minyak kelapa sawit biodiesel Dan kebijakan ini menghemat anggaran impor bahan bakar sebesar US 34 miliar dan mengurangi 89 miliar ton emisi karbondioksida ungkap Presiden,https://www.instagram.com/p/B7QcbrPlci5,459,3
15,13,1,2020,aminuddin.maruf,Halo TegalBrebes  Insya Alloh besok saya silaturahim ke Tegal dan Brebes berdialog untuk berbagi ide gagasan dan pengalaman dengan beberapa komunitas dari mulai pesantren ulama santri penggerak dan aktivis kepemudaan dan pelaku ekonomi UMKM  Dari pertemuan2 seperti ini menjadi input bagi saya merumuskan inovasi dan kebijakan seperti apa yg diperlukan untuk percepatan dan lompatan untuk indonesiamaju yang akan saya sampaikan kepada Presiden  Sampai ketemu besok ya sudah ga sabar nih sekalian pengen makan sate dan kulineran di TegalBrebes,https://www.instagram.com/p/B7QMusDFx-4,918,13
0,13,1,2020,aminuddin.maruf,Persahabatan antar kedua pemimpin negara ini sangat terasa ya,https://www.instagram.com/p/B7OmkuSlLKZ,892,3
16,10,1,2020,aminuddin.maruf,Jika kalian pernah bermain seperti ini bersukurlah karena sekarang permainan ini menjadi barang mewah,https://www.instagram.com/p/B7IjfK4FL5T,662,47
16,8,1,2020,aminuddin.maruf,Jelas tegas   terhadap kedaulatan tidak ada tawar menawar  kapal asing mencuri di wilayah Indonesia  usir tangkap Presiden Jokowi,https://www.instagram.com/p/B7Ddv-jlNVo,464,5
15,8,1,2020,aminuddin.maruf,Natuna itu wilayah Indonesia,https://www.instagram.com/p/B7DXxDelUTG,1279,13
13,8,1,2020,aminuddin.maruf,Dapet motivasi dari senior aktifis mahasiswa yg juga sukses sebagai pengusaha dr muda Menteri sekretariatkabinet Bapak pramonoanungw bagaimana tugas dan tanggungjawab sebagai Staf Khusus Presiden,https://www.instagram.com/p/B7DJlWxllcx,1164,2
17,7,1,2020,aminuddin.maruf,Pose sore ini ,https://www.instagram.com/p/B7A7WaJFCwg,2698,36
23,6,1,2020,aminuddin.maruf,Haaai mana tanganmu ayo lambaikan ,https://www.instagram.com/p/B6_E1GJFnT9,1019,7
12,6,1,2020,aminuddin.maruf,Saya bersama komunitas anak muda kretaif yang menginspirasi dan mampu menggerakkan desa dengan segala potensinya menjadi sumber ekonomi yg menjanjikan  Ya ini Agathis T  Farm agathis_t_f komunitas petani kreatif di Desa Majalaya Karawang yang menanam buah tin dan anggur sebagai produk komoditas unggulannya Mereka tidak hanya memproduksi buahnya tp sudah mampu menyiapkan bibit dan produk olahan dari daun tin yang dijadikan air mineral kemasan  Penduduk Desa Majalaya dibagikan bibit tin secara gratis dan hasil buahnya akan dibeli kembali oleh agathis_t_f  keren kan  Untuk bibit sudah banyak permintaan dari berbagai daerah mereka terkendala aturan soal karantina yg harus dibawa ke tingkat provinsi jadi tidak efisien karena balai karantina adanya di Bandung  Bahkan untuk produk olahan dari daun tin berupa air kemasan mereka sudah punya permintaan pasar ekspor dari Malaysia Tapi lagi2 terkendala dengan ijinnya  Kepala Desa Majalaya juga mendukung loh dengan memberikan modal usaha dari Dana Desa Jadi dana desa tidak hanya digunakan utk belanja rutin gaji perangkat desa dan belanja untuk membangun infrastruktur tapi juga untuk hal produktif seperti BUMDes  ridwankamil cellicanurrachadiana halimiskandarnu kementerianpertanian jerrysambuaga kemenkopukm,https://www.instagram.com/p/B694DgkFuPY,916,11
23,5,1,2020,aminuddin.maruf,Gusdur memang sudah berpulang Tapi gagasannya terbebas dr usia Pemikirannya tak mengenal tua  Jika pemikiran digambarkan dengan usia Pemikiran Gusdur seperti pemuda perkasa Tak akan pernah renta  Pemikiran yang berani melampaui era Pemikiran yang mengurai kekusutan beragama Pemikiran yang mendobrak sekatsekat manusia  Kemarin di acara haul Gusdur oleh gusduriankarawang,https://www.instagram.com/p/B68bS5elTPo,1037,9
18,5,1,2020,aminuddin.maruf,Terimakasih KBNU Karawang dialog yg sangat konstruktif untuk pengembangan pemberdayaan pesantren Kegiatan kedua saya di Karawang,https://www.instagram.com/p/B6776qUl4Ri,741,5
11,5,1,2020,aminuddin.maruf,Saya bertanya kepada temen2 mahasiswa univ singaperbangsa karawang apa yg kalian akan lakukan setelah lulus kuliah Jawabannya beragam tapi pada intinya kebanyakan dr mereka tidak ingin bekerja Loh ko bisa Bukannya setelah selesai menempuh pendidikan harusnya bekerja  Sebagian dr mereka menginginkan peluang hidup mandiri berkreasi dan memaksimalkan potensi lokal daerah asalnya menjadi localpreneur menjadi penggerak pembangunan di desa utk menginspirasi anak muda desa lainnya  Ya pilihan yg tepat Sektor formal tidak mungkin menampung semua angkatan kerja Ke depan kita butuh anak2 muda kreatif utk menggerakan potensi desa ssbagai inspirasi anak2 muda desa lainnya agar tidak semua bermimpi urban ke kota  Acara pertama dr agenda saya dua hari di karawang Ngobrol dengan mahasiswa Univ Singaperbangsa Karawang 3012020,https://www.instagram.com/p/B67MviAlWdF,648,3
19,2,1,2020,aminuddin.maruf,Halo Karawang besok Insya Alloh saya di karawang menghadiri beberapa kegiatan  kuliah umum di Unsika silaturahim dg beberapa tokoh masyarakat di Karawang acara di almamater SMAN 1 Rengasdengklok dan Ponpes Manbaul Ulum Ngobrol dengan petani muda kreatif dan hadir di acara Gusdurian Karawang  Sampe ketemu besok dan hari sabtu ya,https://www.instagram.com/p/B60RbKll_tL,1310,33
17,1,1,2020,aminuddin.maruf,Malam pergantian tahun Andara Izza Nahdliyah  Dia terus tembuh dan semakin cerewet kepadaku Sewaktu di kandungan sering aku berpesan  ayo cepet keluar nanti papih ajak jalan2 mamih kita ga ajak hehe  Sekarang mau beranjak 3th dia semakin cerewet tak mau ketinggalanku Semoga Alloh selalu menjaganya menjadi anak penuh dengan keberuntungan sholihah,https://www.instagram.com/p/B6xeJ6elZ9a,858,4
11,1,1,2020,aminuddin.maruf,Ikutan kaya orang2 aah dadaaaah 2019,https://www.instagram.com/p/B6w2miPlzhL,481,0
1,1,1,2020,aminuddin.maruf,Sslamat datang 2020 Semoga keberkahan senantiasa menyertai kita Optimis dan terus berikhtiar untuk menjadi lebih baik lebih maju,https://www.instagram.com/p/B6vwu2dlBy4,600,7
