Jam,Tanggal,Bulan,Tahun,Username,Caption,Link,Like,Komentar
19,12,11,2020,billymambrasar,You will always be a Superhero for us Daddy Selamat Hari Raya papa Isaschar Mambrasar,https://www.instagram.com/p/CHfYPSyB5Gq,51,0
18,10,11,2020,billymambrasar,SELAMAT HARI PAHLAWAN Guys ,https://www.instagram.com/p/CHaJiY8hyMo,569,11
14,8,11,2020,billymambrasar,Repost jokowi       My warmest congratulations JoeBiden and KamalaHarris on your historic election The huge turn out is a reflection of the hope placed on democracy  Look forward to work closely with you in strengthening IndonesiaUS strategic partnership and pushing forward our cooperation on economy democracy and multilateralism for the benefit of our two people and beyond ,https://www.instagram.com/p/CHUnQoRhWpK,1285,10
6,8,11,2020,billymambrasar,Perjalanan Dinas Tim kami ke Sulawesi Tenggara Kendari Diskusi dengan Gubernur malam ini menghasilkan beberapa poin sbb 1 Diseminasi program2 Presiden khususnya yang berkaitan dengan Covid 19 UMKM dan Milenial 2 Mendengar paparan progres pembangunan Provinsi ini 3 Memaparkan Program papuainspiratif dan Manajemen Talenta Papua MTP bersama dengan kemendagri  4 Mendengar aspirasi dan kebutuhan dari Provinsi ini untuk disampaikan kepada Pemerintah Pusat  Terimakasih Gubernur Sultra _alimazi atas keramah tamahannya dan sambutan yang luar biasa  Saya memberikan apresiasi mendalam atas progress pembangunan yg sudah dan sedang berjalan,https://www.instagram.com/p/CHTujdgBeJC,1602,18
15,4,11,2020,billymambrasar,Topik Milenial Bisa Apa,https://www.instagram.com/p/CHKZWj-gHSN,214,4
16,30,10,2020,billymambrasar,,https://www.instagram.com/p/CG9pI21ANBj,369,22
5,29,10,2020,billymambrasar,Rapat kerja dengan Pak Menteri titokarnavian semalam melahirkan sebuah bentuk program pengelolaan sumber daya manusia Indonesia kedepannya  Pak Menteri ini kreatif idenya banyak akomodatif out of the box dan berani   Tinggal kita eksekusinya aja yah skrg guys  Semoga eksekusinya akan lancar jaya aminn  Sehatsehat terus yah pak,https://www.instagram.com/p/CG55d-4BNQf,1776,47
7,28,10,2020,billymambrasar,Satu Nusa Satu Bangsa Satu Bahasa Kita  Selamat Hari Sumpah pemuda yah guys Kita bisa menjadikan Indonesia negara yang maju adil sejahtera dan merata,https://www.instagram.com/p/CG3i2KFhh4P,1045,27
13,24,10,2020,billymambrasar,Yang Hadir di Acara UNDP Youth Colab Hari ini Ini dia yah challenge Give away Jilid 8 nya temans Langsung comment dibawah guys TAPI JANGAN LUPA DI FOLLOW DULU IGnya   10 orang dgn jawaban paling tepat dan komprehensif akan langsung menerima give away ini   Sukses utk peserta ideathonesia yah,https://www.instagram.com/p/CGt1z05hCPS,306,21
17,23,10,2020,billymambrasar,,https://www.instagram.com/p/CGrqyftAxkD,316,38
8,23,10,2020,billymambrasar,Saya kutip dari Tribunnews  Hari ini Kamis 22102020 diperingati sebagai Hari Santri Nasional 2020  Hari Santri Nasional dimaksudkan untuk mengingat dan meneladani semangat jihad para santri merebut serta mempertahankan kemerdekaan Indonesia yang digelorakan para ulama  Hari Santri Nasional ditetapkan lewat Keputusan Presiden Nomor 22 Tahun 2015 tentang penetapan 22 Oktober sebagai Hari Santri Nasional  Keppres tersebut ditandatangani Presiden Joko Widodo pada 15 Oktober  Tanggal 22 Oktober dipilih karena merujuk pada satu peristiwa bersejarah yakni seruan yang dibacakan oleh Pahlawan Nasional KH Hasjim Asyari pada 22 Oktober 1945  Seruan ini berisikan perintah kepada umat Islam untuk berperang jihad melawan tentara Sekutu yang ingin menjajah kembali wilayah Republik Indonesia pascaProklamasi Kemerdekaan  Perjuangan tersebut berakhir sebuah kemenangan mutlak  Sekali lagi terimakasih saya yang mendalam,https://www.instagram.com/p/CGqtcKiBN6y,752,12
12,12,10,2020,billymambrasar,Ini jawaban dr Pertanyaan Patrick Sawom dari Bali dalam acara ademsurvive hari ini  Buat adikadik yg telah memberikan pertanyaan2nya kam luar biasa Kalian adalah generasi muda Harapan bangsa Masa Depan,https://www.instagram.com/p/CGOzQRPh2sZ,1404,69
11,12,10,2020,billymambrasar,Pendidikan Wawasan Kebangsaan dan Bela Negara Melalui Kawah Kepemimpinan Pelajar Bagi Siswa Program Adem Papua Dan Papua Barat  Direktorat Pendidikan Masyarakat dan Pendidikan Khusus,https://www.instagram.com/p/CGOvb6pjXmO,420,74
19,11,10,2020,billymambrasar,,https://www.instagram.com/p/CGM92D-AfTO,382,26
8,11,10,2020,billymambrasar,Masih sedikit Kilas Balik Turun Lapangan ke Palangka Raya secara khusus saya disambut oleh Walikota Palangka Raya Bang Fairid Naparin  Dengan semangat yang sama beliau yg terpilih menjadi walikota pada usia cukup muda menyambut baik rencana kami untuk menjadikan Palangka Raya sebagai pusat kajian keberlanjutan Indonesia  Palangka Raya adalah sebuah kota yang sangat Indah tertata asri dengan alam Ia merupakan ibukota Provinsi Kalimantan Tengah yg merupakan Provinsi terluas nomor 2 kedua setelah Papua  Dalam diskusi kami beberapa rencana2 yg kami susun termasuk didalamnya adalah membuat event bersama di Kota ini bersama dengan para Milenials kota ini  Saya juga berkesempatan untuk mempromosikan acara Natal Himpunan Mahasiswa Papua Kalimantan nanti di sana dan meminta sokongan beliau  Setiap bulan sebagai Staf Khusus Presiden RI setidaknya 23 kali saya akan turun ke kota dan kampung berbagai Provinsi Indonesia dgn misi beraudiensi dengan berbagai kelompok masyarakat   Dialog tersebut akan saya tuangkan dalam sebuah rekomendasi kebijakan yg akan saya sampaikan langsung ke Presiden dan kementerian yang terkait  Coba tebak guys Kirakira kota apalagi yah berikutnya Yg akan saya kunjungi,https://www.instagram.com/p/CGLzhLghXSO,197,12
11,9,10,2020,billymambrasar,MELATIH ANGGOTA DAN PENGURUS HIMPUNAN MAHASISWA ISLAM CABANG PONTIANAK  Dalam rangkaian Kunjungan Ke Kalimantan selain dari berfokus kepada penugasan untuk membantu tugas kenegaraan adalah memastikan untuk beraudiensi dengan Temanteman dari berbagai organisasi kepemudaan   Ini merupakan tugas penting saya agar saya dapat memastikan bahwa saya mendengar semua masukan aspirasi dan keinginan para pemuda Indonesia ini   Acara yang diselenggarakan ini adalah dalam rangka memberika Pelatihan Kepemimpinan kepada pengurus dan anggota baru HMI  Sebelumnya saya juga mengunjungi dan disambut baik sekali oleh HMI Cabang Sumatera Barat Padang dan kotakota lainnya   Saya doakan agar HMI dapat menjadi organisasi yang dapat mewadahi dan menampung aspirasi seluruh Pemuda dan Pemudi Islam di Kota Pontianak HMI juga dapat menjadi komunikator dan bridging antar program kerja Pemerintah dan Masyarakat   Masa depan Indonesia kedepannya bergantung kepada kekuatan dan kualitas Pemuda dan Pemudi yang akan menjadi demografis penduduk mayoritas negeri ini Ini adalah kunci dari apakah Indonesia nanti akan menjadi negara maju atau tidak   Saya doakan yang terbaik utk seluruh anggota dan pengurus baru HMI baik di Pontianak maupun di kotakota lain di Seluruh Indonesia,https://www.instagram.com/p/CGG_gKCBp4v,528,9
20,5,10,2020,billymambrasar,Yayasan Kitong Bisa bersama Kementerian BUMN di dukung oleh PT Freeport Indonesia Pertamina BRI BNI dan Pegadaian berkolaborasi dengan Forum Human Capital Indonesia Yayasan Green Numa Nusantara Kementerian Pendidikan Wahana Visi Indonesia dan tuan rumah Universitas Advent Indonesia mempersembahkan WEBINAR BUMN seri  4 dengan Tema Solusi Efektif Pendidikan Nasional Era Pandemi COVID19 dengan Pembicara Utama  1 Bpk Nadiem Makarim Menteri Pendidikan RI 2 Bpk Ganjar Pranowo Gubernur Jawa Tengah  Dan Pembicara Ahli   1 Bpk Billy Mambrasar Staf Khusus Presiden 2 Ibu Hetifah Sjaifudian Wakil Ketua Komisi X DPR RI 3 Ibu Lita Karubaba Senior Officer Dana Kemitraan PT Freeport Indonesia 4 Bpk Doseba T Sinay CEO  Direktur Nasional Wahana Visi Indonesia  Moderator Gracia Paramitha Dosen LSPR Jakarta  CoFounder Indonesian Youth Diplomacy  Hari  Selasa 06 Oktober 2020 Pukul 1300 WIB  1500 WIB Live Via  Zoom Webinar  Streaming via Youtube Kementerian BUMN RI   Universitas Advent Indonesia  Acara ini TERBUKA untuk Umum dengan via zoom Registrasi melalui link  httpsbitlywebinarBUMN4 dan dapatkan FREE ECertificate bagi seluruh peserta  FREE Doorprize bagi peserta yang beruntung Maximum peserta Zoom 1000 orang  Informasi lebih lanjut dapat menghubungi email  webinarunaiedu  tlp  081398771966 Henokh Supusepa  WA OnlyNo Call Di jam kerja  Senin sd Jumat 08001700  IndonesiaBergerakMajuBUMN IndonesiaBergerakMajuPertamina IndonesiaBergerakMajuBRI IndonesiaBergerakMajuBNI IndonesiaBergerakMajuPegadaian IndonesiaBergerakMajuTelkom,https://www.instagram.com/p/CF9s9V8B8OU,526,65
19,2,10,2020,billymambrasar,Di Entrepreneurship talk di Salah Satu Coffee Shop dengan Milenial Kota Palangkaraya,https://www.instagram.com/p/CF10USbAHTg,239,5
9,2,10,2020,billymambrasar,Palangkaraya Provinsi Kalimantan Tengah  Luar Biasa terharu dengan semangat adik2 Pesantren Mereka bukan hanya mengaji akan tetapi juga menjalankan kewirausahaan sosial yaitu sambil beternak Ikan Hal ini Patut dicontoh dan cerita baik ini begitu menyentuh hati saya karena sebagian dari mereka adalah anak2 kurang Mampu Saya sudah mencatat dan mengingat apa yg merupakan komitmen kami untuk mereka dan saya akan Follow Up segera,https://www.instagram.com/p/CF0xvfJAR4D,396,58
21,30,9,2020,billymambrasar,Mas Fairid Naparin Walikota Palangkaraya,https://www.instagram.com/p/CFw2hDegttT,191,6
16,30,9,2020,billymambrasar,,https://www.instagram.com/p/CFwWRDQgaKQ,351,19
6,30,9,2020,billymambrasar,Salah satu peran penting yang harus dimainkan oleh kita para senior yang telah sukses adalah memastikan kita menjadi mentor yang baik Proses mentoring harus terus berjalan agar kita dapat meregenerasi pemimpinpemimpin masa depan bangsa kita  Untuk mewujudkan peran tersebut maka saya secara aktif berkeliling Indonesia untuk mementor adikadik saya  Bersama dengan Pak Dirjen Akmal kaka budi_a mas Kus dan tim kami menyemangati mereka  Lihatlah tatapan mata mereka semangat mereka binar cahaya semangat penuh harap menyongsong masa depan  Mereka terpisah jauh ratusan kilometer adanya melewati ribuan pulau utk ada di tempat ini demi mewujudkan cita pendidikannya  Pesan saya untuk adik2ku di Universitas Andalas Padang Sumatera Barat  maju terus pantang mundur Kitong Bisa,https://www.instagram.com/p/CFvRUTQhd7W,1009,30
19,29,9,2020,billymambrasar,Repost budi_a ijin kaka adik copy status yah kaka andalan inspirasiku        Hari2 Kunjungan Bersama Tim Dirjen OTDA Kemendagri dan Tim Staf Khusus Presiden RI dgn Gubernur Sumatera Barat membicarakan mengenai Best Practise Penanganan Covid19 oleh Pemprov Sumbar yg mendapatkan apresiasi Presiden RI sekaligus menitipkan adik2 mahasiswa Papua yg berkuliah di Univ Andalas Univ Negeri Padang Politeknik Negeri Padang dan  Politeknik Pertanian Negeri Payakumbuh  Pertamatama saya SALUT Sama Profesor Irwan Prayitno karena beliau memiliki 10 Anak dan sukses semua dalam pendidikannya Beliau sendiri adalah seorang Profesor dalam bidang Psikologi Salut dan Inspiratif pak Saya ingin menjadi seperti ini kedepannya   Dalam pertemuan itu gubernur Irwan Prayitno menerangkan bahwa Pemerintah Sumbar telah melakukan upaya dalam menekan angka penularan Covid19 yang masih tinggi di wilayah Sumbar Terus lakukan penerapan disiplin protokol kesehatan normal baru berdasarkan epidemiologi peningkatan kesadaran masyarakat  Kuncinya ada empat dari segi pemerintah yaitu bagaimana kemampuan kita mengendalikannya testing pengujian tracking pelacakan isolasi serta treatment pengobatan Bila empat hal ini sungguhsungguh dan konsisten dilakukan secara masif InsyaAllah bisa mengurangi penyebaran Covid19 di Sumbar jelas Irwan Prayitno  Langkahnya ini gubernur arahkan pada satu tujuan yaitu memutus penularan memutus rantai penyebaran Apalagi sampai saat ini obat atau vaksinya antivirus belum ada  Sampai ada antivirusnya Covid19 ini akan tetap ada Jadi selama belum ada obat dan antivirus Covid19 kita mengendalikannya agar tetap landai dan terkontrol katanya  Bila empat hal ini sungguhsungguh dan konsisten menurutnya kalaupun ada tambahan dengan sistem seperti itu akan bisa dikendalikan  Pemerintah sudah sering edukasi masyarakat untuk terus ikuti protokol kesehatan namun masih ada saja yang tidak pakai masker Untuk itu pemerintah akan memberikan saksi bagi masyarakat yang tidak ikuti aturan protokol kesehatan terang Irwan Prayitno,https://www.instagram.com/p/CFuIFx4hwLj,1011,18
10,29,9,2020,billymambrasar,Hey Guys ini dia Pertayaan untuk dijawab sebagai Challenge Giveaway Tahap 3   Pertanyaanya APAKAH 5 TARGET UTAMA KAK BILLY SEBAGAI DUTA SDGs Indonesia 20192021   Bagi Pemenang yang terpilih sebanyak 20 orang akan mendapatkan Kuota Data untuk keperluan studi Daring masingmasing sebanyak 2 GB   Caranya mudah   1 Follow Instagram billymambrasar   2 Ikuti webinarwebinar yang sudah dan akan berlangsung  3 Tulis dan jawab di kolom komentar atas pertanyaanya dibawah ini yah   INGAT Give away ini hanya berlaku untuk followers Kak Billy aja yaaah ,https://www.instagram.com/p/CFtJAG1hFaT,685,63
6,27,9,2020,billymambrasar,Kalau Bayar sendiri saya tdk Punya uang makanya saya mengendorse Cottage milik Sahabat Saya Pak Akmal Karena  PUJI TUHAN bisa numpang tinggal Gratis    Mengapa saya tdk menggunakan masker karena ini rumah yg terisolasi dari luar dan minim interaksi dgn org luar Semua tim kerja bareng2 saya jumlahnya sangat terbatas dan semua sudah diswab dan hasilnya negatif  Selamat berakhir Pekan yaaah teman2 Jaga dan ikuti protokol kesehatan selalu Jaga diri agar sehat selalu,https://www.instagram.com/p/CFnnf1YgDIb,380,31
13,25,9,2020,billymambrasar,Menjalankan tugas saya harus travel ke beberapa tempat selama 2 minggu kedepan tentunya dengan mengikuti secara KETAT Protokol KESEHATAN  Pagi ini saya mendarat di Provinsi Pertama dalam rangkaian kunjunan kerja berama Tim kerja saya Saya sangat Salut untuk Pemerintah Daerah salah satu Provinsi di Indonesia ini yg mendorong seluruh penumpang untuk harus di test Swab saat mendarat di Bandara  Selain itu SWABnya juga diberikan gratis Setelah ketahuan hasilnya maka kita akan diberikan Inisiatif baik seperti ini merupakan sebuah pioneer langkah yang patut kita apresiasi dengan baik Juga dapat dicontoh di berbagai daerah lain di Indonesia  Temanteman bisakah menebak saya sedang di Provinsi apa Dan teman2 dari Provinsi kece ini atau memiliki darah dari sini bisakah mengacungkan jempol dan mengisi kolom komentar dibawah ini  Buat semua yg udh buat appointment see u soon lawancovid19 demiindonesiamaju,https://www.instagram.com/p/CFjKL4BB2VL,1386,111
14,19,9,2020,billymambrasar,OTW ke Bandung sambil Karaoke2 Ceria Iseng2  cover lagu ini sebuah lagu klasik dari Josh Groban,https://www.instagram.com/p/CFTzbLbAYs1,465,47
19,18,9,2020,billymambrasar,PENGUMUMAN GRATIS SMART PHONE Wow 250 orang memberikan masukan atas pertanyaan saya terkait rendahnya literasi dan minat baca Semua masukan tersebut akan menjadi rekomendasi kebijakan yang akan saya sampaikan kepada Direktorat di kementerian terkait Selamat untuk kalian semua saya baca satu per satu loh kawan2 semua masukan masukan teman2 semua Dan semuanya menjadi masukan untuk saya sebagai orang yg memiliki ketertarikan mendalam akan pendidikan  Selamat saya ucapkan kepada 6 Finalis beruntung yg telah memberikan masukan terkait apa kebijakan pemerintah ide inovatif masyarakat dan hal apa yg bisa dikerjakan bersama oleh berbagai pemangku kepentingan untuk menyelesaikan permasalahan Rendahnya literasi dan minat baca di Indonesia  6 Orang ini memberikan masukan yang sangat baik sekali dengan kriteria sbb 1 ACTUAL DAN LUGAS  Fakta yang dipaparkan riil dan menyentuh langsung  Esesensi Persoalan   2  INSPIRATIF  a Berdasarkan Pengalaman Praktis  b  Membuka Mata Menyentuh dan membuat tergugah  c  Menyampaikan fakta dengan santun tanpa menyinggung pihak manapun    3 BERDAMPAK TERHADAP KEBIJAKAN  Solusi yang dikemukan Praktis Simple dan Menyentuh Persoalan serta dapat diterapkan dalam implementasi kebijakan    4 OUT OF THE BOX  Berpikir dari Sudut Pandang Berbeda  Mereka adalah westin_wairara  isha_m2  nehemnya  jessicahristy  revakadang_  meithaandarini  Saya akan mengadakan diskusi head to head dengan 6 orang ini dan mereka akan mendapat Privillege utk memberikan masukan lebih mendalam lagi terkait pergerakan literasi yg sedang saya dorong  Dari interaksi terakhir tersebut maka tim kami akan memilih 1 penerima give away Smartphone dengan quota yg sudah tersedia  Asyik kan Sambil kita bermain sambil kita memikirkan permasalahan negara sambil kita jg mendapat hadiah dalam sebuah kompetisi adu ide ini  Dengan kerendahan hati saya saya mengucapkan terimakasih yg mendalam utk semua yang sudah memberikan sumbangsih ide Masukan anda semua sangat berharga bagi pembangunan Indonesia kita  Salam Literasi dan salam Pembangunan,https://www.instagram.com/p/CFRzOksBTFU,235,21
12,17,9,2020,billymambrasar,Selama masa Covid19 semangat dari anakanak Papua di Tangerang tetap terjaga Mereka mengusahakan lahan kosong dengan menanam berbagai sayuran tanaman ubi2an dan berbagai sumber makanan  Adik2 menamakan kebun ini sebagai Kebun Korona yang memberikan sebuah pesan optimisme bahwa ditengah krisis semangat dan daya juang akan tetap menghasilkan sebuah kreatifitas dan inovasi  Salut dengan semangat adikadiku ini dan saya merasa terhormat atas undangan yang diberikan kepada kami hari ini utk menghadiri acara bakar batu dan ibadah syukur bersama,https://www.instagram.com/p/CFOcX9wgK_Z,455,19
18,11,9,2020,billymambrasar,,https://www.instagram.com/p/CE_ninJg2j_,339,49
15,9,9,2020,billymambrasar,Pada tahun 2019 bersama dengan Putri Indonesia Lingkungan Hidup vaniafherlambang dan juga Putri Sulung Presiden Abdurrahman Wahid Gus Dur Bunda alissa_wahid ditunjuk oleh Menteri Bappenas RI menjadi Duta Tujuan Pembangunan Berkelanjutan Indonesia  Hari ini kami berkesempatan untuk dijamu oleh Menteri PPNBappenas RI  suharsomonoarfa  untuk memaparkan apa yang sudah sedang dan akan kerjakan  Vania sudah bekerja menjadi advocate dalam bidang lingkungan hidup dengan berkeliling Indonesia mendorong isu perlindungan lingkungan Indonesia Bunda Alissa Wahid mendorong isu toleransi dan pencegahan pernikahan dini di seluruh Indonesia Saya masih fokus dalam isu pendidikan pembangunan manusia dan juga pembinaan kewirausahaan di wilayah terluar dan daerah Indonesia Timur  Dalam paparan Pak Menteri atas apa yg kami kerjakan Beliau menyampaikan dukungan penuhnya atas programprogram yang kami paparkan dan beliau memberikan petuah dan wejangan kedepannya  Temanteman tau kan Apa itu Sustainable Development Goals SDGs sdgs_indonesia sdgawareness  Yang sudah tau apa itu boleh komentar dibawah sini yaaah  Tau kah temanteman bahwa ternyata angka pencapaian SDGs kita masih pas banget dengan angka ratarata global Bahkan masih dibawah ratarata negara lain  di dunia Dan skor paling rendah kita adalah salah satunya Perlindungan Kehidupan di Daratan Life on Land termasuk perlindungan hutan  Juga tingkat penjagaan perdamaian dan keberagaman  Menurut temanteman apa faktorfaktor yg membuat dua hal diatas rendah Apa yang harus kami duta SDGs Indonesia kerjakan untuk membantu negara kita meningkatkan pencapaian skor SDGs yg lebih baik khususnya di dua hal diatas  Saya tunggu respons temanteman semua dibawah yah untuk Indonesia kita yang lebih baik tentunya ,https://www.instagram.com/p/CE6JzrJhjz9,880,11
7,8,9,2020,billymambrasar,Rapat kordinasi kerja mengenai Promosi Pangan berfokus kepada SAGU yang akan dilakukan pada bulan depan Rapat ini disinergikan bersama Deputi Pangan Kemenko Ekonomi dengan saya hadir sebagai undangan untuk memberikan input dan masukan bersama beberapa kepala daerah provindi di Indonesia termasuk Kepala Dinas Perindagkop Provinsi Papua dan Kepala Dinas Tenaga Kerja Kabupaten Mimika bersama beberapa pimpinan yang terkait  Festival Sagu tersebut akan diadakan pada Bulan Depan 1617 Oktober 2020 dengan keterlibatan 14 Provinsi penghasil Sagu di Indonesia termasuk Provinsi Papua dan Papua Barat Tugas saya adalah bagaimana mendorong inovasi berbasis pangan yang digerakkan oleh anakanak muda Indonesia  Banyak yg berpikir Indonesia hanyalah identik dengan beras  nasi padahal banyak sekali daerah yang bergantung kepada sagu sebagai sumber utama pangannya  Salah satu bentuk ketahanan Nasional sebuah Negara selain ketahanan Energi dan Keamanan Negara adalah Ketahanan Pangan Oleh sebab itu  berdasarkan FAO salah satu kriteria pengukuran ketahanan Pangan Food Security Multidimensional Index adalah beragamnya jenis Pangan yang dipergunakan untuk memenuhi kebutuhan masyarakat   Artinya bahwa semakin beragam semakin tinggi ketahanan Pangan negara tersebut Semakin kita hanya bergatung sama satu saja jenis sumber pangan semakin lemah ketahanan pangan kita  Bayangkan saja guys tiba2 misalnya ada sejenis Hama berbahaya yang mematikan semua ladang padi di Indonesia dan kita kehilangan beras sebagai sumber pangan maka dipastikan kita akan mengalami kelaparan nasional   Oleh sebab itu yang paling ideal adalah kita mengembangkan berbagai jenis sumber pangan yang berbeda untuk memastikan ketahanan pangan kita  Selama periode orde baru fokus pengembangan pangan hanyalah ke Beras dan Nasi dan sumber pangan lain seperti Sagu dan umbi umbian hampir terlupakan Sekarang saatnya kita promosikan kekayaan daerah kita termasuk keberagaman sumber nutrisi  Buat temanteman yang secara tradisional berasal dari Provinsi atau kabupaten yg sumber makanannya sejak dahulu kala sebelum promosi bisa tulis di kolom komentar dibawah ini,https://www.instagram.com/p/CE2xLalBQ_v,1554,70
20,6,9,2020,billymambrasar,,https://www.instagram.com/p/CEy9YuygK2y,367,25
10,6,9,2020,billymambrasar,Cover Lagu kali ini untuk menemani hari minggu penuh percintaan kalian semua ijinkan saya bawa lagu yang Berjudul Bahasa Kalbu dinyanyikan oleh Titi DJ  Pada Tahun 2000  Lagu ini merupakan soundtrack dari Sinetron Cinta yg diperankan oleh Dessy Ratnasari Sebagai Tokoh Utama Wanita bersama dengan Atallarik Syah dan Primus Yustision   Dalam sinetron tersebut terjadi hubungan percintaan yang rumit antara Dessy Ratnasari yang jatuh cinta sama Primus Yustisio Adik dari Attalarik Syah padahal Dessy sudah Bertunangan dengan Attalarik   Coba temanteman yang angkatan 90an dan dulu pernah nonton sambil menangis terharu Nonton Sinteron ini tulis di kolom komentar   Terimakasih untuk sahabat SMA saya dr melfrits_siwabessy_  yang sudah mengiringi saya nyanyi Jam live di rumah dan di mini studionya di Sorong ,https://www.instagram.com/p/CEx7LRlhdho,443,50
12,5,9,2020,billymambrasar,Guys untuk weekend kali ini saya akan menghabiskannya dengan menulis sisa chapter novel saya dsn menyelesaikan buku bacaan saya yg berjudul Why Nations Fail  The Origins of Power Prosperity and Poverty Oleh Acemoglu dan Robinson  Hampir setiap menit sebuah ponton dengan muatan batu bara ditarik boat menyusuri sungai besar Indonesia ini  Saya penasaran seperti pakah pemandangan ini ratusan tahun lalu Sebelum industri mengerayapi sebuah Pulau Besar Nusantara ini   Semilir angin siang berbau daun dalam balur lumpur segar menyentuh menggelitik hidung  Sepotong bebek rica manis tadi sudah menemani makan siangku dan bisik aliran air sungai ini seperti berkata Yuk Billy tidur sejenak agar sebentar Pukul 3 nanti bisa mengisi acara dengan segar  Boleh temanteman ikutan nebak di Kota Manakah saat ini saya berada,https://www.instagram.com/p/CEvkSpyguOL,303,65
16,31,8,2020,billymambrasar,Graceshella Tridasalin Octavia Mambrasar vs Gracia Josaphat Jobel Mambrasar  SIBLINGS  Adik beradik ini Sama sama bacot sama2 bukan pendengar yang baik sama2 sabaran sama2 tukang marah sama2 pemimpi besar dan sama2 sayang ortu  Klo persamaan dalam hal2 yang baik kata orang banyak Tapi kalau saya tulis nanti disangka RIA menyombongkan diri   Intinya sih  jarang2 saya posting foto sama sibling yaaah tapi saya mau skalian promosi buat pria2 lajang saya open endorse adik saya ini graceisaschar   Thanks for taking care of our parents yaaah billysdiary billymambrasar sellymambrasar adikkakak siblings siblinglove siblinggoals siblinggoals,https://www.instagram.com/p/CEjE7pzhREE,2098,70
9,29,8,2020,billymambrasar,Lembaga Pemasyarakatan Serui Papua Menemani Papa pelayanan,https://www.instagram.com/p/CEdLIN_grzy,409,32
7,27,8,2020,billymambrasar,Temanteman ijinkan saya memperkenalkan makanan tradisional khas Papua juga Maluku Papeda dan Ikan Kuah Kuning dengan Umbiumbian sayuran dan beberapa hidangan pelengkap lainnya  Papeda terbuat dari sari tepung sagu yang kemudian diolah dengan air panas secara khusus dan akhirnya berbentuk seperti Jelly Makannya harus ditemani dengan ikan yang berkuah kuning panas Makanan ini sudah sangat common dikonsumsi oleh masyarakat di Tanah Papua dan Maluku  Papeda mengandung kadar gula yg rendah dan serat yang tinggi Akan tetapi Papeda memiliki energi yang cukup untuk membantu kita beraktifitas seharihari  Papeda juga mengandung antioksidan yg tinggi untuk menjaga kesehatan kulit dan antibodi untuk tubuh  Temanteman kalian Ada yang ingin mencobanya kah  atau mungkin temanteman sudah pernah mencobanya billymambrasar billysdiary diarybilly diarybillymambrasar papeda papua papuabarat maluku,https://www.instagram.com/p/CEX3DXwB-JH,1811,186
